book_id,goodreads_book_id,authors,original_publication_year,title,language_code
4741,15748335,Cherrie Lynn,2012.0,"Leave Me Breathless (Ross Siblings, #3)",eng
4742,19095025,Kylie Scott,2014.0,"Play (Stage Dive, #2)",eng
4743,6441654,"Rebecca Housel, J. Jeremy Wisnewski, William Irwin",2009.0,"Twilight and Philosophy: Vampires, Vegetarians, and the Pursuit of Immortality",eng
4744,49176,Eric Berne,1964.0,Games People Play,eng
4745,18966322,Brandon Sanderson,2013.0,"Mitosis (The Reckoners, #1.5)",eng
4746,7186,"Alexandre Dumas fils, David Coward",1848.0,La Dame aux Camélias,eng
4747,11942639,Rachel Hauck,2012.0,The Wedding Dress,eng
4748,206309,"Stephen C. Lundin, Harry Paul, John Christensen, Kenneth H. Blanchard",1996.0,Fish: A Proven Way to Boost Morale and Improve Results,eng
4749,49250,Stephen E. Ambrose,1994.0,"D-Day, June 6, 1944: The Battle for the Normandy Beaches",eng
4750,7981456,Linda Sue Park,2010.0,A Long Walk to Water: Based on a True Story,eng
4751,8811139,Michael  Grant,2013.0,"Light (Gone, #6)",eng
4752,28477789,"Vi Keeland, Penelope Ward",2016.0,Stuck-Up Suit,eng
4753,189147,Philip José Farmer,1971.0,"To Your Scattered Bodies Go (Riverworld, #1)",eng
4754,114132,Nora Roberts,2001.0,Midnight Bayou,eng
4755,12967,Mark Helprin,1983.0,Winter's Tale,eng
4756,106646,Sidney Sheldon,1991.0,The Doomsday Conspiracy,eng
4757,201175,"J.D. Robb, Susan Ericksen",1996.0,"Rapture in Death (In Death, #4)",
4758,161744,Thomas Paine,1776.0,Common Sense,eng
4759,54529,Adeline Yen Mah,1997.0,Falling Leaves: The Memoir of an Unwanted Chinese Daughter,eng
4760,3338544,مصطفى محمود,1970.0,رحلتي من الشك إلى الإيمان,ara
4761,13416236,C.C. Hunter,2012.0,"Whispers at Moonrise (Shadow Falls, #4)",eng
4762,7148931,Timothy Ferriss,2000.0,"The 4-Hour Body: An Uncommon Guide to Rapid Fat-Loss, Incredible Sex, and Becoming Superhuman",eng
4763,58314,"Michel Houellebecq, Frank Wynne",1998.0,The Elementary Particles,eng
4764,17314410,Georgia Cates,2013.0,"Beauty from Surrender (Beauty, #2)",eng
4765,224410,"Roy Thomas, Dick Giordano, Mark D. Beazley, Bram Stoker",2005.0,Dracula (Marvel Illustrated),
4766,207266,Dav Pilkey,1997.0,"The Adventures of Captain Underpants (Captain Underpants, #1)",eng
4767,13435889,Paul Tough,2012.0,"How Children Succeed: Grit, Curiosity, and the Hidden Power of Character",eng
4768,149049,Arthur C. Clarke,1979.0,The Fountains of Paradise,eng
4769,98920,Elif Shafak,2006.0,The Bastard of Istanbul,eng
4770,17237214,David Levithan,2013.0,Two Boys Kissing,eng
4771,5171894,James Rollins,,"The Doomsday Key (Sigma Force, #6)",eng
4772,21726,Scott B. Smith,2006.0,The Ruins,eng
4773,336245,Erin Hunter,2004.0,"A Dangerous Path (Warriors, #5)",eng
4774,543339,Michael Blake,1988.0,"Dances with Wolves (Dances with Wolves, #1)",eng
4775,153779,Tamora Pierce,2009.0,"Bloodhound (Beka Cooper, #2)",eng
4776,6122735,Brent Weeks,2009.0,"The Night Angel Trilogy (Night Angel, #1-3)",eng
4777,426025,William Faulkner,1930.0,A Rose for Emily and Other Stories,eng
4778,5883777,Anonymous,2001.0,The Holy Bible: English Standard Version,eng
4779,321545,Ellis Peters,1977.0,"A Morbid Taste for Bones (Chronicles of Brother Cadfael, #1)",eng
4780,233389,"Giorgio Vasari, Julia Conway Bondanella, Peter Bondanella",1550.0,The Lives of the Artists,eng
4781,84139,Sherrilyn Kenyon,2005.0,"Unleash the Night (Dark Hunter, #8; Were-Hunter, #2)",eng
4782,4935682,Angie Sage,2009.0,"Syren (Septimus Heap, #5)",eng
4783,5558786,"Dmitry Glukhovsky, M. David Drevs",2005.0,"Metro 2033 (METRO, #1)",ger
4784,5396496,Christos Tsiolkas,2008.0,The Slap,eng
4785,207781,"Robert Henri, Forbes Watson, Margery A. Ryerson",1929.0,"The Art Spirit: Notes, Articles, Fragments of Letters and Talks to Students, Bearing on the Concept and Technique of Picture Making, the Study of Art (Icon Editions)",eng
4786,17171909,Marcus Sakey,2013.0,"Brilliance (Brilliance Saga, #1)",eng
4787,26583370,Camille Pagán,2015.0,Life and Other Near-Death Experiences,eng
4788,9799,Jonathan Lethem,2003.0,The Fortress of Solitude,eng
4789,379316,Dean Koontz,2007.0,The Darkest Evening of the Year,eng
4790,18077769,Jeff VanderMeer,2014.0,"Authority (Southern Reach, #2)",eng
4791,277190,"Holly Black, Tony DiTerlizzi",2004.0,"The Wrath of Mulgarath (The Spiderwick Chronicles, #5)",eng
4792,11101772,Caroline Preston,2011.0,The Scrapbook of Frankie Pratt,eng
4793,251762,Myla Goldberg,2000.0,Bee Season,eng
4794,182012,Karin Slaughter,2004.0,"Indelible (Grant County, #4)",eng
4795,236208,Dean Koontz,1976.0,Night Chills,eng
4796,29254,"Ram Dass, Richard Alpert",1971.0,Be Here Now,eng
4797,6530,Patricia Cornwell,2004.0,"Trace (Kay Scarpetta, #13)",eng
4798,1279686,Conn Iggulden,2007.0,"Genghis: Birth of an Empire (Conqueror, #1)",eng
4799,291354,David Eddings,1990.0,"The Ruby Knight (The Elenium, #2)",eng
4800,32638,Clive Barker,1992.0,The Thief of Always,eng
4801,715791,Lara Adrian,2007.0,"Kiss of Crimson (Midnight Breed, #2)",eng
4802,2653622,Tess Gerritsen,2008.0,"The Keepsake (Rizzoli & Isles, #7)",eng
4803,17660462,Brad Stone,2013.0,The Everything Store: Jeff Bezos and the Age of Amazon,eng
4804,25564446,Brittainy C. Cherry,2015.0,"The Air He Breathes (Elements, #1)",
4805,3585344,Kresley Cole,2009.0,Kiss of a Demon King (Immortals After Dark #7),eng
4806,478951,Steven Erikson,2006.0,"The Bonehunters (Malazan Book of the Fallen, #6)",eng
4807,16119079,Heidi McLaughlin,2012.0,"Forever My Girl (The Beaumont Series, #1)",eng
4808,22341276,Charlie N. Holmberg,2014.0,"The Glass Magician (The Paper Magician Trilogy, #2)",
4809,10098912,Ashwin Sanghi,2010.0,Chanakya's Chant,eng
4810,12467,Norman Mailer,1948.0,The Naked and the Dead,eng
4811,35100,James M. McPherson,1988.0,Battle Cry of Freedom,eng
4812,646056,"Michael Teitelbaum, Sue DiCicco",1989.0,The Little Mermaid,
4813,86424,"James Patterson, Andrew Gross",2005.0,Lifeguard,
4814,7783920,Rob Buyea,2010.0,Because of Mr. Terupt,eng
4815,37739,Judy Blume,1974.0,Blubber,eng
4816,7954556,Jeaniene Frost,2011.0,"One Grave at a Time (Night Huntress, #6)",eng
4817,9897164,Jennifer L. Armentrout,2013.0,"Apollyon (Covenant, #4)",eng
4818,6202661,Lindsey Kelk,2009.0,"I Heart New York (I Heart, #1)",eng
4819,2213324,Meg Cabot,2008.0,"Airhead (Airhead, #1)",eng
4820,25190,"A.N. Roquelaure, Anne Rice",1985.0,"Beauty's Release (Sleeping Beauty, #3)",eng
4821,3389671,Beth Fantaskey,2000.0,"Jessica's Guide to Dating on the Dark Side (Jessica, #1)",eng
4822,26596,E.E. Cummings,1991.0,"Complete Poems, 1904-1962",eng
4823,1635,"Larry Bossidy, Ram Charan, Charles Burck",2009.0,Execution: The Discipline of Getting Things Done,eng
4824,20663702,Caitlin Doughty,2014.0,Smoke Gets in Your Eyes: And Other Lessons from the Crematory,eng
4825,7096123,Daniel Silva,2010.0,"The Rembrandt Affair (Gabriel Allon, #10)",eng
4826,15730101,H.P. Lovecraft,1928.0,The Call of Cthulhu,eng
4827,373915,"Joe Hill, Christopher Golden",2005.0,20th Century Ghosts,eng
4828,6819,David Mitchell,1999.0,Ghostwritten,eng
4829,21219083,Simon Wood,2015.0,The One That Got Away,eng
4830,8709528,Richelle Mead,2015.0,"The Ruby Circle (Bloodlines, #6)",eng
4831,5983694,Grace Lin,2009.0,Where the Mountain Meets the Moon,eng
4832,125190,Arthur Ransome,1930.0,"Swallows and Amazons (Swallows and Amazons, #1)",eng
4833,9442157,Olivia Cunning,2011.0,"Rock Hard (Sinners on Tour, #2)",eng
4834,20525628,Caitlin Moran,2014.0,How to Build a Girl,eng
4835,1407874,Andrea Hirata,2006.0,"Sang Pemimpi (Tetralogi Laskar Pelangi, #2)",ind
4836,28116,A.J. Jacobs,2004.0,The Know-It-All: One Man's Humble Quest to Become the Smartest Person in the World,eng
4837,15811495,Lisa Gardner,2013.0,"Touch & Go (Tessa Leoni, #2)",eng
4838,126807,Chris Bohjalian,2007.0,The Double Bind,eng
4839,9751378,Mary Kay Andrews,2011.0,Summer Rental,eng
4840,23553419,S.K. Tremayne,2015.0,The Ice Twins,eng
4841,17899696,J.A. Redmerski,2013.0,"The Edge of Always (The Edge of Never, #2)",eng
4842,2873,Tracy Chevalier,1997.0,The Virgin Blue,eng
4843,15797397,Michael Moss,2013.0,Salt Sugar Fat: How the Food Giants Hooked Us,eng
4844,225038,"Edward Eager, N.M. Bodecker",1954.0,"Half Magic (Tales of Magic, #1)",eng
4845,7090785,"Steve Hockensmith, Jane Austen, Patrick Arrasmith",2007.0,"Dawn of the Dreadfuls (Pride and Prejudice and Zombies, #0.5)",eng
4846,7180727,Lisa Gardner,2010.0,"Live to Tell (Detective D.D. Warren, #4)",eng
4847,825081,Kevin Henkes,1996.0,Lilly's Purple Plastic Purse,
4848,368916,Helene Hanff,1970.0,"84, Charing Cross Road",eng
4849,5153799,J.R. Ward,2008.0,"Father Mine (Black Dagger Brotherhood, #6.5)",eng
4850,14572,"Thich Nhat Hanh, Arnold Kotler, Dalai Lama XIV",1990.0,Peace Is Every Step: The Path of Mindfulness in Everyday Life,eng
4851,6686671,Kyousuke Motomi,2007.0,"Electric Daisy, Vol. 1 (Dengeki Daisy, #1)",ind
4852,29868610,Anna Kendrick,2016.0,Scrappy Little Nobody,eng
4853,24429934,Robert Masello,2015.0,The Einstein Prophecy,eng
4854,7307795,Kate Atkinson,2010.0,"Started Early, Took My Dog (Jackson Brodie, #4)",eng
4855,107032,"Jim Starlin, Jim Aparo, Mike DeCarlo",1988.0,Batman: A Death in the Family,eng
4856,16085517,Colum McCann,2013.0,TransAtlantic,eng
4857,6871616,Jeaniene Frost,2010.0,"Eternal Kiss of Darkness (Night Huntress World, #2)",eng
4858,129117,Lisa Lutz,2007.0,"The Spellman Files (The Spellmans, #1)",eng
4859,32626,Clive Barker,1984.0,Books of Blood: Volumes One to Three (Books of Blood #1-3),eng
4860,294046,James Rollins,2007.0,"The Judas Strain (Sigma Force, #4)",eng
4861,33333,Donald Miller,2000.0,Searching for God Knows What,eng
4862,30122,Shel Silverstein,1976.0,The Missing Piece,
4863,56842,Robert   Harris,1992.0,Fatherland,eng
4864,7132363,Daniel Suarez,2010.0,"Freedom™ (Daemon, #2)",eng
4865,92508,Thornton Wilder,1927.0,The Bridge of San Luis Rey,eng
4866,1772910,Fyodor Dostoyevsky,1848.0,White Nights,eng
4867,5215879,Laurell K. Hamilton,2009.0,"Skin Trade (Anita Blake, Vampire Hunter #17)",eng
4868,481749,James E. Talmage,1915.0,Jesus the Christ,
4869,1693617,Don Ferguson,1994.0,Disney's the Lion King,eng
4870,31168,"Charlotte Brontë, Lucasta Miller, collaborative, Jessica Cox",1849.0,Shirley,
4871,114129,Nora Roberts,1995.0,"Born in Ice (Born In Trilogy, #2)",eng
4872,9569,Tom Robbins,2003.0,Villa Incognito,
4873,22237161,Paul Beatty,2015.0,The Sellout,eng
4874,21325,"Bill Willingham, Mark Buckingham, Craig Hamilton, Steve Leialoha, P. Craig Russell",2004.0,"Fables, Vol. 4: March of the Wooden Soldiers",eng
4875,28077464,"Lee Child, Dick Hill",2016.0,Night School,eng
4876,9578677,Tess Gerritsen,2011.0,"The Silent Girl (Rizzoli & Isles, #9)",eng
4877,11301,Dr. Seuss,1940.0,Horton Hatches the Egg,eng
4878,17733861,Bella Forrest,,"A Shade of Blood (A Shade of Vampire, #2)",eng
4879,15827066,"Jenna Miscavige Hill, Lisa Pulitzer",2013.0,Beyond Belief: My Secret Life Inside Scientology and My Harrowing Escape,eng
4880,73945,"Plato, James J. Helm",-390.0,Apology,eng
4881,102953,"Garth Ennis, Steve Dillon, Penn Jillette",1997.0,"Preacher, Volume 3: Proud Americans",eng
4882,12880428,Anne Rice,2012.0,"The Wolf Gift (The Wolf Gift Chronicles, #1)",eng
4883,867650,"Diane Muldrow, J.P. Miller",1954.0,The Little Red Hen (Little Golden Book),
4884,10875239,Sandra Brown,2011.0,Lethal,
4885,3974,Dan Simmons,2007.0,The Terror,eng
4886,773606,Ludwig Bemelmans,1953.0,Madeline's Rescue,eng
4887,6694937,"John Heilemann, Mark Halperin",2010.0,"Game Change: Obama and the Clintons, McCain and Palin, and the Race of a Lifetime",
4888,659622,V.C. Andrews,1987.0,"Garden of Shadows (Dollanganger, #5)",eng
4889,10599805,Kim Harrison,2012.0,"A Perfect Blood (The Hollows, #10)",eng
4890,124524,"Joni Eareckson Tada, Joe Musser",1976.0,Joni: An Unforgettable Story,eng
4891,93768,"Margaret Weis, Tracy Hickman",1986.0,"War of the Twins (Dragonlance: Legends, #2)",eng
4892,7856305,James Patterson,2010.0,"Cross Fire (Alex Cross, #17)",eng
4893,148821,Ross King,2000.0,Brunelleschi's Dome: How a Renaissance Genius Reinvented Architecture,eng
4894,582533,Shakti Gawain,1978.0,Creative Visualization: Use the Power of Your Imagination to Create What You Want in Your Life,eng
4895,40329,Janet Evanovich,2004.0,"Metro Girl (Alex Barnaby, #1)",eng
4896,25454883,"Colleen Hoover, Tarryn Fisher",2016.0,"Never Never: Part Three (Never Never, #3)",eng
4897,9565045,Darynda Jones,2011.0,"Second Grave on the Left (Charley Davidson, #2)",eng
4898,33609,"Anya Seton, Philippa Gregory",1954.0,Katherine,eng
4899,828387,Marina Lewycka,2005.0,A Short History of Tractors in Ukrainian,eng
4900,22693182,Kimberly McCreight,2015.0,Where They Found Her,eng
4901,125925,Kelley Armstrong,2004.0,"Industrial Magic (Women of the Otherworld, #4)",eng
4902,74256,"René Goscinny, Jean-Jacques Sempé",1959.0,"Le Petit Nicolas (Le petit Nicolas, #1)",fre
4903,18867685,A.G. Riddle,2013.0,"The Atlantis Plague (The Origin Mystery, #2)",eng
4904,42512,"Harold G. Moore, Joseph L. Galloway",1991.0,We Were Soldiers Once... and Young: Ia Drang - The Battle that Changed the War in Vietnam,eng
4905,92367,Ken Follett,2004.0,Whiteout,eng
4906,568236,Barbara W. Tuchman,1978.0,A Distant Mirror:  The Calamitous 14th Century,eng
4907,28899,Mike Lupica,2006.0,Heat,eng
4908,900,Neil Strauss,2005.0,The Game: Penetrating the Secret Society of Pickup Artists,eng
4909,64864,Sue Grafton,1998.0,"N is for Noose (Kinsey Millhone, #14)",eng
4910,8476248,Julia Quinn,2011.0,Just Like Heaven (Smythe-Smith Quartet #1),eng
4911,6443349,"Rick Riordan, Tk",2009.0,"Percy Jackson and the Olympians Boxed Set (Percy Jackson and the Olympians, #1-5)",
4912,11720382,Lisa Gardner,2012.0,"Catch Me (Detective D.D. Warren, #6)",eng
4913,233044,Debbie Macomber,2003.0,"The Shop on Blossom Street (Blossom Street, #1)",eng
4914,239102,R.A. Salvatore,1992.0,"Starless Night (Forgotten Realms: Legacy of the Drow, #2; Legend of Drizzt, #8)",eng
4915,93788,Nelson DeMille,2004.0,"Night Fall (John Corey, #3)",eng
4916,8967,Darren Shan,2001.0,"Trials of Death (Cirque Du Freak, #5)",
4917,7144426,"Eric Van Lustbader, Robert Ludlum",2010.0,"The Bourne Objective (Jason Bourne, #8)",eng
4918,27252717,Elle Kennedy,2016.0,"The Score (Off-Campus, #3)",eng
4919,289644,Karen Kingsbury,2005.0,"Even Now (Lost Love, #1)",eng
4920,3121162,Anita Shreve,2008.0,Testimony,eng
4921,11544421,Ilona Andrews,2013.0,"Magic Rises (Kate Daniels, #6)",eng
4922,9970042,Ben Aaronovitch,2012.0,"Whispers Under Ground (Peter Grant, #3)",eng
4923,18453095,"James Patterson, Maxine Paetro",2014.0,"Unlucky 13 (Women’s Murder Club, #13)",eng
4924,99610,Sidney Sheldon,1997.0,The Best Laid Plans,eng
4925,2855034,Terry Pratchett,2008.0,Nation,eng
4926,114162,Lisa Kleypas,2004.0,"Secrets of a Summer Night (Wallflowers, #1)",eng
4927,456028,Ted Dekker,2004.0,"Red: The Heroic Rescue (The Circle, #2)",eng
4928,10680329,Louise Penny,2011.0,"A Trick of the Light (Chief Inspector Armand Gamache, #7)",eng
4929,17455585,Jennifer L. Armentrout,2014.0,"White Hot Kiss (The Dark Elements, #1)",eng
4930,1717890,"Jun Mochizuki, 望月淳",2006.0,Pandora Hearts 1巻,jpn
4931,32769,H.P. Lovecraft,1931.0,At the Mountains of Madness and Other Tales of Terror,eng
4932,6340016,Mary Karr,2008.0,Lit,eng
4933,465904,Anne McCaffrey,1988.0,"Dragonsdawn (Pern, #9)",
4934,6596547,Kathryn Erskine,2010.0,Mockingbird,eng
4935,13489517,أحمد حلمي,2012.0,28 حرف,ara
4936,107195,Joshua Harris,1996.0,I Kissed Dating Goodbye,
4937,903,Zilpha Keatley Snyder,1967.0,"The Egypt Game (Game, #1)",eng
4938,277397,Kaye Gibbons,1987.0,Ellen Foster,eng
4939,22904,"Franz Kafka, Nahum N. Glatzer, John Updike, Willa Muir, Edwin Muir, Tania Stern, James Stern, Ernst Kaiser, Eithne Wilkins",1946.0,The Complete Stories,eng
4940,1059680,"Isa Chandra Moskowitz, Terry Hope Romero",2007.0,Veganomicon: The Ultimate Vegan Cookbook,
4941,260025,"Margaret Weis, Tracy Hickman",1986.0,"Test of the Twins (Dragonlance: Legends, #3)",eng
4942,48467,Flannery O'Connor,1952.0,Wise Blood,eng
4943,220826,Sabahattin Ali,1943.0,Kürk Mantolu Madonna,tur
4944,187124,Terry Brooks,1997.0,"Running with the Demon (Word & Void, #1)",eng
4945,223838,Charles M. Sheldon,1896.0,In His Steps,
4946,10790516,Kresley Cole,2012.0,Lothaire (Immortals After Dark #12),eng
4947,515905,Mo Willems,2007.0,"Knuffle Bunny Too: A Case of Mistaken Identity (Knuffle Bunny, #2)",eng
4948,2260637,David Baldacci,2008.0,"The Whole Truth (A. Shaw, #1)",eng
4949,2659997,"Elissa Wall, Lisa Pulitzer",2008.0,"Stolen Innocence: My Story of Growing Up in a Polygamous Sect, Becoming a Teenage Bride, and Breaking Free of Warren Jeffs",
4950,11178225,Ruta Sepetys,2013.0,Out of the Easy,eng
4951,2182780,"Ed Brubaker, Doug Mahnke, Patrick Zircher, Aaron Sowd, Steve Bird",2005.0,Batman: The Man Who Laughs,eng
4952,273511,Erin Hunter,2005.0,"Midnight (Warriors: The New Prophecy, #1)",eng
4953,18176747,Ben Horowitz,2014.0,The Hard Thing About Hard Things: Building a Business When There Are No Easy Answers,eng
4954,11051889,Jessica Sorensen,2011.0,"The Fallen Star (Fallen Star, #1)",
4955,228990,Stephen R. Donaldson,1977.0,"The Illearth War (The Chronicles of Thomas Covenant the Unbeliever, #2)",
4956,2063563,Russell Brand,2007.0,My Booky Wook,eng
4957,18527947,Nora Roberts,2014.0,"Shadow Spell (The Cousins O'Dwyer Trilogy, #2)",eng
4958,10909804,Simon Garfield,2010.0,Just My Type: A Book About Fonts,eng
4959,3492020,J.D. Robb,2009.0,"Promises in Death (In Death, #28)",eng
4960,23534,Charles Bukowski,1977.0,Love Is a Dog from Hell,eng
4961,19161852,N.K. Jemisin,2015.0,"The Fifth Season (The Broken Earth, #1)",eng
4962,13568322,R.D. Ronald,2012.0,The Zombie Room,eng
4963,67931,John Katzenbach,2002.0,The Analyst,eng
4964,2113260,Jasper Fforde,2009.0,Shades of Grey,eng
4965,33569,S.E. Hinton,1971.0,"That Was Then, This Is Now",eng
4966,6164358,"Trenton Lee Stewart, Del Roy",2009.0,"The Mysterious Benedict Society and the Prisoner's Dilemma (The Mysterious Benedict Society, #3)",
4967,10149142,Kevin    Wilson,2011.0,The Family Fang,eng
4968,10907,Chris Gardner,2006.0,The Pursuit of Happyness,
4969,7147831,Karl Ove Knausgård,2009.0,Min kamp 1 (Min kamp #1),nor
4970,8517008,Alan Bradley,2011.0,"A Red Herring Without Mustard (Flavia de Luce, #3)",eng
4971,18728,Doris Kearns Goodwin,1994.0,No Ordinary Time: Franklin and Eleanor Roosevelt: The Home Front in World War II,eng
4972,414298,Richard Russo,1997.0,Straight Man,eng
4973,10739,Walker Percy,1961.0,The Moviegoer,eng
4974,87346,"Anton Chekhov, Tom    Murphy",1904.0,The Cherry Orchard,eng
4975,4835838,Wendy Mass,2009.0,"11 Birthdays (Willow Falls, #1)",eng
4976,7329,"J.R.R. Tolkien, Christopher Tolkien",1980.0,Unfinished Tales of Númenor and Middle-Earth,
4977,9461872,Ann Brashares,2011.0,"Sisterhood Everlasting (Sisterhood, #5)",eng
4978,349090,Grant Naylor,1989.0,Infinity Welcomes Careful Drivers (Red Dwarf #1),eng
4979,33459,Christopher Moore,1994.0,Coyote Blue,eng
4980,2501455,"أحلام مستغانمي, Ahlam Mosteghanemi",1997.0,فوضى الحواس,ara
4981,87665,G.K. Chesterton,1908.0,Orthodoxy,eng
4982,426625,"Jane O'Connor, Robin Preiss Glasser",2005.0,Fancy Nancy,
4983,3692,Graham Greene,1948.0,The Heart of the Matter,eng
4984,21535019,Jeff Kinney,2014.0,"The Long Haul (Diary of a Wimpy Kid, #9)",eng
4985,169871,"Patricia C. Wrede, Peter de Sève",1985.0,"Talking to Dragons (Enchanted Forest Chronicles, #4)",eng
4986,2029176,"James Patterson, Howard Roughan",2008.0,Sail,eng
4987,23301545,"Neil Gaiman, Chris Riddell",2014.0,The Sleeper and the Spindle,eng
4988,18114142,Susan Meissner,2014.0,A Fall of Marigolds,
4989,18750,"A.N. Roquelaure, Anne Rice",1984.0,"Beauty's Punishment (Sleeping Beauty, #2)",eng
4990,285011,Dee Henderson,2000.0,"The Negotiator (O'Malley, #1)",eng
4991,13041934,Ravinder Singh,2011.0,Can Love Happen Twice?,eng
4992,3124249,"Gregory Maguire, Douglas Smith",2008.0,"A Lion Among Men (The Wicked Years, #3)",eng
4993,43908,Raymond E. Feist,1994.0,"Shadow of a Dark Queen (The Serpentwar Saga, #1)",eng
4994,11466,Tobias Wolff,1989.0,This Boy's Life,eng
4995,3993839,Jonathan Maberry,2009.0,"Patient Zero (Joe Ledger, #1)",eng
4996,545951,Willa Cather,1927.0,Death Comes for the Archbishop,eng
4997,7942786,Patricia Briggs,2012.0,"Fair Game (Alpha & Omega, #3)",eng
4998,17312201,Rick Riordan,2013.0,"The Son of Sobek (Percy Jackson & Kane Chronicles Crossover, #1)",eng
4999,52823,"Molière, Martin Sorrell",1664.0,Tartuffe,eng
5000,4701550,Larissa Ione,2009.0,Passion Unleashed (Demonica #3),eng
5001,1896346,Kazune Kawahara,2004.0,"High School Debut, Vol. 01 (High School Debut, #1)",eng
5002,10400407,أثير عبدالله النشمي,2011.0,في ديسمبر تنتهي كل الأحلام,ara
5003,386234,Mercer Mayer,1975.0,Just for You (Little Critter),eng
5004,294047,James Rollins,2002.0,Amazonia,eng
5005,46674,David D. Burns,1980.0,Feeling Good: The New Mood Therapy,eng
5006,114184,Nora Roberts,2005.0,Blue Smoke,eng
5007,6528,Patricia Cornwell,2005.0,"Predator (Kay Scarpetta, #14)",eng
5008,720298,Melody Beattie,1986.0,Codependent No More: How to Stop Controlling Others and Start Caring for Yourself,
5009,254308,"Ivan Goncharov, Stephen Pearl, Galya Diment",1859.0,Oblomov,eng
5010,198332,Clive Cussler,1994.0,"Inca Gold (Dirk Pitt, #12)",eng
5011,18167006,Ruth Reichl,2014.0,Delicious!,eng
5012,6496815,"Po Bronson, Ashley Merryman",2008.0,NurtureShock: New Thinking About Children,eng
5013,1849,Nelson DeMille,2006.0,"Wild Fire (John Corey, #4)",eng
5014,154423,Mary Higgins Clark,2006.0,Two Little Girls in Blue,eng
5015,589979,"Raymond E. Feist, Janny Wurts",1987.0,"Daughter of the Empire (The Empire Trilogy, #1)",eng
5016,688191,Neal Shusterman,2006.0,"Everlost (Skinjacker, #1)",eng
5017,8534799,Kresley Cole,2011.0,Dreams of a Dark Warrior (Immortals After Dark #11),eng
5018,7824997,"John Grisham, Richard Thomas",2010.0,"Theodore Boone: Kid Lawyer (Theodore Boone, #1)",eng
5019,34072,Chris Ware,2000.0,"Jimmy Corrigan, the Smartest Kid on Earth",
5020,39980,Richard Peck,2000.0,"A Year Down Yonder (A Long Way from Chicago, #2)",eng
5021,16163690,Kristen Ashley,2013.0,"Own the Wind (Chaos, #1)",eng
5022,4516,Carlos Ruiz Zafón,1999.0,Marina,spa
5023,7135858,Ann Brashares,2010.0,My Name Is Memory,eng
5024,15054,Jeanette Winterson,1992.0,Written on the Body,eng
5025,7849341,Colleen Houck,2011.0,"Tiger's Voyage (The Tiger Saga, #3)",eng
5026,605015,Dean Koontz,2009.0,"Dead and Alive (Dean Koontz's Frankenstein, #3)",eng
5027,4591,Matt Ridley,1999.0,Genome: the Autobiography of a Species in 23 Chapters,eng
5028,53580,Sandra Boynton,1982.0,The Going-To-Bed Book,eng
5029,112675,Louise Rennison,2001.0,"Knocked Out by My Nunga-Nungas (Confessions of Georgia Nicolson, #3)",eng
5030,27526,"Tim LaHaye, Jerry B. Jenkins",2001.0,"Desecration (Left Behind, #9)",eng
5031,18114068,Phil Klay,2014.0,Redeployment,eng
5032,6512140,Libba Bray,2009.0,Going Bovine,eng
5033,25807,James M. Cain,1934.0,The Postman Always Rings Twice,eng
5034,6555517,Carrie Ryan,2010.0,"The Dead-Tossed Waves (The Forest of Hands and Teeth, #2)",eng
5035,9530,Robert Kurson,2004.0,Shadow Divers,eng
5036,8293938,Clare Vanderpool,2010.0,Moon Over Manifest,eng
5037,77103,Amitav Ghosh,2000.0,The Glass Palace,eng
5038,10710392,"Jessica Anthony, Rodrigo Corral",2012.0,Chopsticks,eng
5039,21853628,Lisa Scottoline,2015.0,Every Fifteen Minutes,eng
5040,16279856,James Dashner,2013.0,"The Eye of Minds (The Mortality Doctrine, #1)",eng
5041,140278,Agatha Christie,1957.0,"4:50 from Paddington (Miss Marple, #8)",eng
5042,74036,J.D. Robb,1997.0,"Ceremony in Death (In Death, #5)",eng
5043,18373214,"Jo Nesbø, Don Bartlett",1998.0,"Cockroaches (Harry Hole, #2)",eng
5044,140078,Charlaine Harris,2006.0,"Grave Surprise (Harper Connelly, #2)",eng
5045,3304,"Isabel Allende, Margaret Sayers Peden",2002.0,"City of the Beasts (Eagle and Jaguar, #1)",eng
5046,2364284,"Naguib Mahfouz, نجيب محفوظ",1959.0,أولاد حارتنا,ara
5047,68497,China Miéville,2002.0,"The Scar (Bas-Lag, #2)",eng
5048,23225,Meg Cabot,2003.0,"Haunted (The Mediator, #5)",eng
5049,28553,Anne McCaffrey,1979.0,"Dragondrums (Harper Hall, #3)",eng
5050,9545064,Rachel Simon,2011.0,The Story of Beautiful Girl,
5051,18646,Dava Sobel,1999.0,"Galileo's Daughter: A Historical Memoir of Science, Faith and Love",eng
5052,42692,Leon Uris,1961.0,Mila 18,eng
5053,11391817,Allen Say,2011.0,Drawing from Memory,eng
5054,1330324,Amitav Ghosh,2008.0,"Sea of Poppies (Ibis Trilogy, #1)",eng
5055,99245,"Isaac Asimov, Robert Silverberg",1970.0,Nightfall,eng
5056,18005,"Melinda Long, David Shannon",2003.0,How I Became a Pirate,eng
5057,99208,Edward Abbey,1975.0,"The Monkey Wrench Gang (Monkey Wrench Gang, #1)",eng
5058,6323821,John Irving,2009.0,Last Night in Twisted River,eng
5059,10115852,Rob Bell,2011.0,"Love Wins: A Book About Heaven, Hell, and the Fate of Every Person Who Ever Lived",eng
5060,9376345,Rachel Caine,2011.0,"Bite Club (The Morganville Vampires, #10)",eng
5061,78970,Jeffrey Archer,1985.0,A Matter of Honor,
5062,469901,Linda Howard,2000.0,Mr. Perfect,eng
5063,16093188,M. Leighton,2013.0,"Up to Me (The Bad Boys, #2)",eng
5064,16124019,Mira Lyn Kelly,2012.0,"Waking Up Married (Waking Up, #1)",eng
5065,1225261,Linwood Barclay,2007.0,No Time for Goodbye (No Time For Goodbye #1),eng
5066,207802,Katherine Hannigan,2004.0,"Ida B. . . and Her Plans to Maximize Fun, Avoid Disaster, and (Possibly) Save the World",eng
5067,4703450,Robin Hobb,2009.0,"The Dragon Keeper (Rain Wild Chronicles, #1)",eng
5068,210404,Aldo Leopold,1949.0,A Sand County Almanac and Sketches Here and There,
5069,895886,"Eric Knight, Marguerite Kirmse",1940.0,Lassie Come-Home,
5070,178788,"T. Colin Campbell, Thomas M. Campbell II",2001.0,"The China Study: The Most Comprehensive Study of Nutrition Ever Conducted And the Startling Implications for Diet, Weight Loss, And Long-term Health",eng
5071,1013383,"Julia Donaldson, Axel Scheffler",1999.0,The Gruffalo,eng
5072,359,Douglas Adams,2002.0,"The Salmon of Doubt (Dirk Gently, #3)",eng
