book_id,goodreads_book_id,authors,original_publication_year,title,language_code
2418,10822858,"Jussi Adler-Olsen, Lisa Hartford",2007.0,"The Keeper of Lost Causes (Department Q, #1)",eng
2419,23876,Gabriel García Márquez,1994.0,Of Love and Other Demons,eng
2420,3992598,Rick Riordan,2009.0,The Demigod Files (Percy Jackson and the Olympians),eng
2421,1297985,Oliver Sacks,2007.0,Musicophilia: Tales of Music and the Brain,eng
2422,25526965,Stephen King,2016.0,"End of Watch (Bill Hodges Trilogy, #3)",eng
2423,3684856,Christopher Moore,2009.0,Fool,eng
2424,69136,John Connolly,2006.0,The Book of Lost Things,eng
2425,49195,Bill Clinton,2004.0,My Life,eng
2426,59952,"Frank Miller, Lynn Varley",1998.0,300,eng
2427,6697305,Linda Sue Park,2010.0,"Storm Warning (The 39 Clues, #9)",eng
2428,6950688,Ally Carter,2010.0,"Only the Good Spy Young (Gallagher Girls, #4)",eng
2429,455941,Lee Child,2003.0,"Persuader (Jack Reacher, #7)",eng
2430,58077,Charlaine Harris,2005.0,"Grave Sight (Harper Connelly, #1)",eng
2431,1991039,"Jo Nesbø, Don Bartlett",1997.0,"Flaggermusmannen (Harry Hole, #1)",nor
2432,407234,Nora Roberts,2007.0,"Blood Brothers (Sign of Seven, #1)",eng
2433,10912,Jodi Picoult,1995.0,Picture Perfect,eng
2434,294963,"Nobuhiro Watsuki, Kenichiro Yagi",1994.0,"Rurouni Kenshin, Vol. 1: Meiji Swordsman Romantic Story (Rurouni Kenshin, #1)",eng
2435,9888775,Miranda Kenneally,2011.0,Catching Jordan,eng
2436,18600,Joe Simpson,1988.0,Touching the Void: The True Story of One Man's Miraculous Survival,eng
2437,15784909,Colleen Hoover,2013.0,"This Girl (Slammed, #3)",eng
2438,205330,Simms Taback,1997.0,There Was an Old Lady Who Swallowed a Fly,
2439,2255,Dan Millman,1980.0,Way of the Peaceful Warrior: A Book That Changes Lives,eng
2440,12781,Salman Rushdie,1988.0,The Satanic Verses,eng
2441,6178648,Barbara Demick,2009.0,Nothing to Envy: Ordinary Lives in North Korea,eng
2442,866222,"Jack Welch, Suzy Welch",1992.0,Winning,
2443,17158596,Gail McHugh,2013.0,"Collide (Collide, #1)",eng
2444,3860977,Jonah Lehrer,2009.0,How We Decide,eng
2445,91661,Laurie R. King,1994.0,"The Beekeeper's Apprentice (Mary Russell, #1)",eng
2446,356321,"Jean de Brunhoff, Merle S. Haas",1931.0,The Story of Babar,eng
2447,8458018,Michael Scott,2011.0,"The Warlock (The Secrets of the Immortal Nicholas Flamel, #5)",eng
2448,6316821,Jim Butcher,2008.0,"First Lord's Fury (Codex Alera, #6)",eng
2449,6834410,Tom Rachman,2010.0,The Imperfectionists,eng
2450,16151178,Katja Millay,2012.0,The Sea of Tranquility,eng
2451,9517,"Marjane Satrapi, Anjali Singh",2001.0,"Persepolis 2: The Story of a Return (Persepolis, #2)",eng
2452,64217,Terry Pratchett,1989.0,"Pyramids (Discworld, #7)",eng
2453,149302,Raymond E. Feist,1985.0,"Silverthorn (The Riftwar Saga, #3)",eng
2454,1314332,Jenny Downham,2007.0,Before I Die,eng
2455,6728738,Elizabeth Gilbert,2009.0,Committed: A Skeptic Makes Peace with Marriage,eng
2456,104378,Sarah Dessen,1999.0,Keeping the Moon,eng
2457,18080920,Veronica Roth,2013.0,"The Transfer (Divergent, #0.1)",eng
2458,43887,Terry Goodkind,2004.0,"Chainfire (Sword of Truth, #9)",eng
2459,129650,"Julia Child, Simone Beck, Louisette Bertholle",1961.0,Mastering the Art of French Cooking,eng
2460,9876989,"Kazue Kato, John Werry",2009.0,"Blue Exorcist, Vol. 1  (Blue Exorcist, #1)",eng
2461,604803,Terry Goodkind,2007.0,"Confessor (Sword of Truth, #11)",eng
2462,88815,Mohsin Hamid,2007.0,The Reluctant Fundamentalist,eng
2463,12432220,Jennifer A. Nielsen,2012.0,The False Prince (The Ascendance Trilogy #1),eng
2464,85386,John Updike,1960.0,"Rabbit, Run (Rabbit Angstrom #1)",eng
2465,56627,Daniel Todd Gilbert,2006.0,Stumbling on Happiness,eng
2466,400412,T.S. Eliot,1922.0,The Waste Land and Other Poems,eng
2467,201146,"Else Holmelund Minarik, Maurice Sendak",1957.0,Little Bear,eng
2468,206172,Edgar Allan Poe,1842.0,The Pit and the Pendulum,eng
2469,34529,Terry Pratchett,1992.0,"Lords and Ladies (Discworld, #14; Witches #4)",eng
2470,62530,Terry Pratchett,2006.0,"Thud! (Discworld, #34; City Watch #7)",eng
2471,28876,Naomi Novik,2006.0,"His Majesty's Dragon (Temeraire, #1)",eng
2472,444304,"Holly Black, Tony DiTerlizzi",2003.0,"The Field Guide (The Spiderwick Chronicles, #1)",eng
2473,7497897,David Platt,2010.0,Radical: Taking Back Your Faith from the American Dream,eng
2474,1303,"Robert Greene, Joost Elffers",1988.0,The 48 Laws of Power,
2475,41667,Jean Craighead George,1959.0,"My Side of the Mountain (Mountain, #1)",eng
2476,3392089,"Susanna Kearsley, Rosalyn Landor",2008.0,"The Winter Sea (Slains, #1)",eng
2477,5861926,Peter Lerangis,2009.0,"The Sword Thief (The 39 Clues, #3)",eng
2478,85437,Robin Cook,1977.0,Coma,eng
2479,46945,"Hubert Selby Jr., Darren Aronofsky, Richard Price",1978.0,Requiem for a Dream,eng
2480,111332,Erin Hunter,2003.0,"Into the Wild (Warriors, #1)",eng
2481,76401,Dee Brown,1970.0,Bury My Heart at Wounded Knee: An Indian History of the American West,
2482,128066,"Władysław Szpilman, Anthea Bell",1946.0,"The Pianist: The Extraordinary Story of One Man's Survival in Warsaw, 1939–45",
2483,16033902,Maya Banks,2013.0,"Rush (Breathless, #1)",eng
2484,3052106,"Ian Edginton, Oscar Wilde, I.N.J. Culbard",2009.0,The Picture of Dorian Gray: A Graphic Novel,eng
2485,11557,Robert McCammon,1987.0,Swan Song,eng
2486,22522805,Kazuo Ishiguro,2015.0,The Buried Giant,eng
2487,68494,China Miéville,2000.0,"Perdido Street Station (Bas-Lag, #1)",eng
2488,4070493,Carrie Jones,2008.0,"Need (Need, #1)",eng
2489,2442,Terry Pratchett,1991.0,"Witches Abroad (Discworld, #12; Witches #3)",eng
2490,721012,"Geoffrey Crayon, Washington Irving, William L. Hedges",1819.0,The Legend of Sleepy Hollow and Other Stories,eng
2491,117,Frank Herbert,1984.0,Heretics of Dune (Dune Chronicles #5),eng
2492,772852,"David Wilkerson, John Sherrill, Elizabeth Sherrill",1963.0,The Cross and the Switchblade,
2493,346087,Jim Butcher,2007.0,"Captain's Fury (Codex Alera, #4)",eng
2494,9912994,Chuck Palahniuk,2011.0,"Damned (Damned, #1)",eng
2495,222458,Cynthia Lord,2006.0,Rules,
2496,8584686,Karen Russell,2011.0,Swamplandia!,eng
2497,49353,Michael Connelly,1995.0,"The Last Coyote (Harry Bosch, #4; Harry Bosch Universe, #4)",eng
2498,2715,Mark Kurlansky,2002.0,Salt: A World History,eng
2499,31173,"Charlotte Brontë, A.S. Byatt, Μαρία Λαϊνά, Ignes Sodre",1853.0,Villette,eng
2500,10552338,Neal Stephenson,2011.0,Reamde,eng
2501,34502,Terry Pratchett,1994.0,"Soul Music (Discworld, #16; Death, #3)",eng
2502,14740588,Janet Evanovich,2012.0,"Notorious Nineteen (Stephanie Plum, #19)",eng
2503,6117055,Richard Dawkins,2009.0,The Greatest Show on Earth: The Evidence for Evolution,eng
2504,392297,Frank Miller,1992.0,"Sin City, Vol. 1: The Hard Goodbye (Sin City, #1)",eng
2505,356896,Og Mandino,1968.0,The Greatest Salesman in the World,eng
2506,3758,Ian Fleming,1953.0,"Casino Royale (James Bond, #1)",eng
2507,83144,Paullina Simons,2001.0,"The Bronze Horseman (The Bronze Horseman, #1)",eng
2508,11346,Toni Morrison,1973.0,Sula,eng
2509,17999892,A.G. Riddle,2013.0,"The Atlantis Gene (The Origin Mystery, #1)",eng
2510,7148256,Philippa Gregory,2010.0,"The Red Queen (The Plantagenet and Tudor Novels, #3)",eng
2511,6642402,Julie James,2010.0,"Something About You (FBI/US Attorney, #1)",eng
2512,105552,Dr. Seuss,1970.0,Mr. Brown Can Moo! Can You?,eng
2513,10607,"Stephen King, Peter Straub",2001.0,"Black House (The Talisman, #2)",eng
2514,15719,"Neil Gaiman, Andy Kubert, Richard Isanove, Peter Sanderson",2003.0,Marvel 1602,eng
2515,26722,Vince Flynn,2006.0,"Act of Treason (Mitch Rapp, #9)",eng
2516,13330761,Peter Heller,2012.0,The Dog Stars,
2517,19494,John le Carré,1963.0,The Spy Who Came In from the Cold,eng
2518,133664,Jim Butcher,2005.0,"Academ's Fury (Codex Alera, #2)",eng
2519,13162,James Patterson,1998.0,"When the Wind Blows (When the Wind Blows, #1)",eng
2520,6443834,"Haruki Murakami, 村上 春樹",2009.0,"1Q84 BOOK 1 (1Q84, #1)",jpn
2521,4004,"Paulo Coelho, Alan R. Clarke",1987.0,The Pilgrimage,eng
2522,383028,Lee Child,2006.0,"The Hard Way (Jack Reacher, #10)",eng
2523,231821,Sheila Burnford,1960.0,The Incredible Journey,eng
2524,13529,Geraldine Brooks,2004.0,March,eng
2525,13359067,"Lee Child, Dick Hill",2012.0,"A Wanted Man (Jack Reacher, #17)",eng
2526,22369,"Grant Morrison, Frank Quitely",2007.0,"All-Star Superman, Vol. 1",eng
2527,12177850,George R.R. Martin,2000.0,"A Song of Ice and Fire (A Song of Ice and Fire, #1-5)",eng
2528,16158558,Nora Roberts,2013.0,"Dark Witch (The Cousins O'Dwyer Trilogy, #1)",eng
2529,7198988,Alyson Noel,2010.0,"Dark Flame (The Immortals, #4)",eng
2530,25734248,Fiona Barton,2016.0,The Widow,eng
2531,6255144,Patrick Carman,2009.0,"The Black Circle (The 39 Clues, #5)",eng
2532,15820748,Kiera Cass,2013.0,"The Prince (The Selection, #0.5)",
2533,16069030,Marie Rutkoski,2014.0,"The Winner's Curse (The Winner's Trilogy, #1)",eng
2534,71332,Sapphire,1996.0,Push,eng
2535,17465515,"Elena Ferrante, Ann Goldstein",2012.0,The Story of a New Name (The Neapolitan Novels #2),eng
2536,70539,Arthur C. Clarke,1982.0,"2010: Odyssey Two (Space Odyssey, #2)",eng
2537,6406018,Atsushi Ohkubo,2004.0,"Soul Eater, Vol. 01 (Soul Eater, #1)",eng
2538,15803059,William Kent Krueger,2013.0,Ordinary Grace,eng
2539,14839,David Baldacci,2001.0,Last Man Standing,eng
2540,118944,Gene Luen Yang,2006.0,American Born Chinese,eng
2541,1335184,"Eugene Bradley Coco, Ron Dias, Walt Disney Company",1960.0,Peter Pan (A Little Golden Book),eng
2542,15990969,K.A. Tucker,2012.0,"Ten Tiny Breaths (Ten Tiny Breaths, #1)",eng
2543,7141642,David Mitchell,2010.0,The Thousand Autumns of Jacob de Zoet,eng
2544,18525,Christopher Marlowe,1604.0,Dr. Faustus,eng
2545,84145,Sherrilyn Kenyon,2003.0,Dance with the Devil (Dark-Hunter #3),eng
2546,6614,Candace Bushnell,2005.0,Lipstick Jungle,eng
2547,79379,James Patterson,2001.0,"Violets Are Blue (Alex Cross, #7)",eng
2548,180116,"Anthony Robbins, Tony Robbins, Frederick L. Covan",1992.0,"Awaken the Giant Within: How to Take Immediate Control of Your Mental, Emotional, Physical and Financial Destiny!",eng
2549,30246,Laurell K. Hamilton,1998.0,"Blue Moon (Anita Blake, Vampire Hunter, #8)",eng
2550,30242,Laurell K. Hamilton,1998.0,"Burnt Offerings (Anita Blake, Vampire Hunter, #7)",eng
2551,19286669,Diane Chamberlain,2014.0,"The Silent Sister (Riley MacPherson, #1)",eng
2552,9597,Kurt Vonnegut Jr.,1952.0,Player Piano,eng
2553,10155,Arthur Conan Doyle,1912.0,"The Lost World (Professor Challenger, #1)",
2554,34511,Terry Pratchett,2003.0,"Monstrous Regiment (Discworld, #31; Industrial Revolution, #3)",eng
2555,60931,Octavia E. Butler,1979.0,Kindred,eng
2556,8282,"Laura Ingalls Wilder, Garth Williams",1940.0,"The Long Winter (Little House, #6)",
2557,525488,"Henry Cloud, John Townsend",1992.0,"Boundaries: When to Say Yes, How to Say No to Take Control of Your Life",eng
2558,17378508,Maggie Stiefvater,2014.0,"Blue Lily, Lily Blue (The Raven Cycle, #3)",eng
2559,43945,"Philip Roth, Luca Marinelli",1969.0,Portnoy's Complaint,
2560,815716,"John C. Maxwell, Zig Ziglar",1998.0,The 21 Irrefutable Laws of Leadership: Follow Them and People Will Follow You,eng
2561,51019,Margaret Atwood,1988.0,Cat's Eye,eng
2562,15783307,J. Sterling,2012.0,"The Perfect Game (The Perfect Game, #1)",eng
2563,7540092,Patrick Ness,2010.0,"Monsters of Men (Chaos Walking, #3)",eng
2564,8647,Orson Scott Card,2005.0,"Shadow of the Giant (Ender's Shadow, #4)",eng
2565,10128428,Brian Selznick,2011.0,Wonderstruck,eng
2566,748862,Sarah Ban Breathnach,1995.0,Simple Abundance:  A Daybook of Comfort and Joy,eng
2567,9917938,Moira Young,2011.0,"Blood Red Road (Dust Lands, #1)",eng
2568,13131,"James Patterson, Maxine Paetro",2007.0,"The 6th Target (Women's Murder Club, #6)",eng
2569,40395,"Edgar Rice Burroughs, John Seelye",1912.0,"A Princess of Mars (Barsoom, #1)",eng
2570,17262203,Margaret Atwood,2013.0,"MaddAddam (MaddAddam, #3)",eng
2571,77770,"Laura Ingalls Wilder, Garth Williams",1943.0,"These Happy Golden Years (Little House, #8)",eng
2572,19596,Victoria Finlay,2003.0,Color: A Natural History of the Palette,eng
2573,5357,John Grisham,2001.0,Skipping Christmas,eng
2574,24244,Michael Connelly,1993.0,"The Black Ice (Harry Bosch, #2; Harry Bosch Universe, #2)",eng
2575,12022079,Kristin Hannah,2012.0,Home Front,eng
2576,16117506,Christina Lauren,2013.0,"Beautiful Stranger (Beautiful Bastard, #2)",eng
2577,127459,Libba Bray,2007.0,"The Sweet Far Thing (Gemma Doyle, #3)",eng
2578,5197,Ernest J. Gaines,1993.0,A Lesson Before Dying,eng
2579,178357,David Sedaris,1998.0,SantaLand Diaries,eng
2580,24820165,Nicholas Sparks,2015.0,See Me,eng
2581,7415016,Sophie Kinsella,2010.0,"Mini Shopaholic (Shopaholic, #6)",eng
2582,857448,"Gene Zion, Margaret Bloy Graham",1956.0,Harry the Dirty Dog,eng
2583,18144115,Jennifer Weiner,2014.0,All Fall Down,eng
2584,393199,George Orwell,1933.0,Down and Out in Paris and London,eng
2585,6081685,Hiro Fujiwara,2006.0,"Maid-sama! Vol. 01 (Maid-sama!, #1)",eng
2586,381102,Nick Bantock,1991.0,Griffin and Sabine (Griffin & Sabine #1),eng
2587,14061957,Leigh Bardugo,2014.0,"Ruin and Rising (Shadow and Bone, #3)",eng
2588,3503947,أحمد خالد توفيق,2008.0,يوتوبيا,ara
2589,421549,Jennifer Weiner,2000.0,Certain Girls (Cannie Shapiro #2),eng
2590,13152194,Cheryl Strayed,2012.0,Tiny Beautiful Things: Advice on Love and Life from Dear Sugar,
2591,743599,Karen Marie Moning,1999.0,"Beyond the Highland Mist (Highlander, #1)",eng
2592,15654,Ann Rule,1980.0,The Stranger Beside Me: Ted Bundy The Shocking Inside Story,eng
2593,3054684,Claudia Gray,2009.0,"Stargazer (Evernight, #2)",eng
2594,7668,Michael Crichton,1992.0,Rising Sun,eng
2595,136167,Sidney Sheldon,1973.0,The Other Side of Midnight (Midnight #1),eng
2596,7936809,Michael Connelly,2010.0,"The Reversal (Harry Bosch, #16; Mickey Haller, #4; Harry Bosch Universe, #19)",eng
2597,10065,"Louis Sachar, Joel Schick",1989.0,Wayside School Is Falling Down (Wayside School #2),eng
2598,7274337,"Julie Orringer, Arthur Morey",2010.0,The Invisible Bridge,eng
2599,15861491,Pittacus Lore,2013.0,"The Fall of Five (Lorien Legacies, #4)",eng
2600,56759,"Thomas Hardy, Keith Wilson",1886.0,The Mayor of Casterbridge,eng
2601,8732,John Steinbeck,1933.0,The Red Pony,
2602,498389,Jo Nesbø,2003.0,"The Devil's Star (Harry Hole, #5)",eng
2603,5159,Alice Hoffman,1997.0,Here on Earth,eng
2604,119091,"Anne Rice, Tim Curry",1994.0,"Taltos (Lives of the Mayfair Witches, #3)",
2605,190361,Laurell K. Hamilton,2000.0,"Obsidian Butterfly (Anita Blake, Vampire Hunter, #9)",eng
2606,9268487,Peter V. Brett,2013.0,"The Daylight War (Demon Cycle, #3)",eng
2607,1248179,John Grisham,2008.0,The Appeal,eng
2608,13830,Tamora Pierce,1986.0,"The Woman Who Rides Like a Man (Song of the Lioness, #3)",eng
2609,8680417,Ben Aaronovitch,2011.0,"Midnight Riot (Peter Grant, #1)",eng
2610,9303,Marian Keyes,1996.0,Lucy Sullivan Is Getting Married,eng
2611,34501,Terry Pratchett,2004.0,"A Hat Full of Sky (Discworld, #32; Tiffany Aching, #2)",eng
2612,50365,Vikram Seth,1993.0,"A Suitable Boy (A Suitable Boy, #1)",eng
2613,22738563,Chimamanda Ngozi Adichie,2014.0,We Should All Be Feminists,eng
2614,8087906,Patricia Briggs,2011.0,"River Marked (Mercy Thompson, #6)",eng
2615,4135,Amy Sedaris,2006.0,I Like You: Hospitality Under the Influence,eng
2616,22320,William Gibson,2003.0,"Pattern Recognition (Blue Ant, #1)",eng
2617,21936809,Peter  Swanson,2015.0,The Kind Worth Killing,eng
2618,11525,Patricia Schultz,2003.0,"1,000 Places to See Before You Die",
2619,355916,"Angie Sage, Mark Zug",2007.0,"Physik (Septimus Heap, #3)",eng
2620,6667,"Roald Dahl, Quentin Blake",1984.0,Boy: Tales of Childhood,eng
2621,10890,Anne Lamott,1999.0,Traveling Mercies: Some Thoughts on Faith,eng
2622,184657,Vince Flynn,2004.0,"Memorial Day (Mitch Rapp, #7)",eng
2623,13836,Tamora Pierce,1992.0,"Wild Magic (Immortals, #1)",eng
2624,30013,Isaac Asimov,1988.0,Prelude to Foundation,eng
2625,56728,Max Lucado,1997.0,"You Are Special (Wemmicksville, #1)",eng
2626,18798983,Renee Ahdieh,2015.0,"The Wrath and the Dawn (The Wrath and the Dawn, #1)",eng
2627,6260997,"Nicholas D. Kristof, Sheryl WuDunn",2008.0,Half the Sky: Turning Oppression into Opportunity for Women Worldwide,eng
2628,10798418,"Daniel Handler, Maira Kalman",2011.0,Why We Broke Up,eng
2629,18243700,Sarah J. Maas,2014.0,"The Assassin's Blade (Throne of Glass, #0.1-0.5)",eng
2630,2807199,Curtis Sittenfeld,2008.0,American Wife,eng
2631,29394,Jim Butcher,2006.0,"Cursor's Fury (Codex Alera, #3)",eng
2632,334176,Mary Doria Russell,1996.0,"The Sparrow (The Sparrow, #1)",eng
2633,10910,Jodi Picoult,1996.0,Mercy,eng
2634,20727654,Charlie N. Holmberg,2014.0,"The Paper Magician (The Paper Magician Trilogy, #1)",eng
2635,6023056,Steve Harvey,2009.0,"Act Like a Lady, Think Like a Man: What Men Really Think About Love, Relationships, Intimacy, and Commitment",
2636,10335318,Candice Millard,2011.0,"Destiny of the Republic: A Tale of Madness, Medicine and the Murder of a President",eng
2637,89724,"Shirley Jackson, Jonathan Lethem",1962.0,We Have Always Lived in the Castle,eng
2638,56405,Emerson Eggerichs,2004.0,Love and Respect: The Love She Most Desires; The Respect He Desperately Needs,
2639,2761626,Michael Connelly,2008.0,"The Brass Verdict (Harry Bosch, #14; Mickey Haller, #2; Harry Bosch Universe, #17)",eng
2640,216442,Timothy Zahn,1992.0,Dark Force Rising,eng
2641,17262159,Lee Child,2013.0,"Never Go Back (Jack Reacher, #18)",eng
2642,183656,Gail Carson Levine,2001.0,The Two Princesses of Bamarre,eng
2643,228630,"Richard Wright, Jerry W. Ward Jr.",1945.0,Black Boy,eng
2644,5167,Lalita Tademy,2001.0,Cane River,eng
2645,43884,Terry Goodkind,2006.0,"Phantom (Sword of Truth, #10)",
2646,29582,Isaac Asimov,1986.0,Foundation and Earth (Foundation #5),eng
2647,10058,"James D. Bradley, Ron Powers",2000.0,Flags of Our Fathers,
2648,99111,"A.A. Milne, Ernest H. Shepard",1926.0,"The World of Winnie-the-Pooh (Winnie-the-Pooh, #1-2)",eng
2649,112803,Mahatma Gandhi,1940.0,The Story of My Experiments With Truth,eng
2650,2265,"Lance Armstrong, Sally Jenkins",1999.0,It's Not About the Bike: My Journey Back to Life,eng
2651,45546,Stephen E. Ambrose,1996.0,Undaunted Courage: The Pioneering First Mission to Explore America's Wild Frontier,eng
2652,18803640,Helen Macdonald,2015.0,H is for Hawk,eng
2653,21423525,David Nicholls,2014.0,Us,eng
2654,66695,R.A. Salvatore,1990.0,"Sojourn (Forgotten Realms: The Dark Elf Trilogy, #3; Legend of Drizzt, #3)",eng
2655,6393082,"Christopher Yost, Orson Scott Card, Pasqual Ferry, Frank D'Armata",2009.0,"Ender's Game, Volume 1: Battle School (Ender's Saga)",eng
2656,6218007,"Karuho Shiina, Tomo Kimura",2006.0,"Kimi ni Todoke: From Me to You, Vol. 1",eng
2657,182425,Dean Koontz,1999.0,False Memory,eng
2658,34510,Terry Pratchett,1990.0,"Moving Pictures (Discworld, #10; Industrial Revolution, #1)",eng
2659,12513614,C.J. Roberts,2011.0,"Captive in the Dark (The Dark Duet, #1)",eng
2660,81959,James Allen,1902.0,As a Man Thinketh,eng
2661,2082136,Mary Roach,2008.0,Bonk: The Curious Coupling of Science and Sex,eng
2662,544257,Rachel Caine,2007.0,"Midnight Alley (The Morganville Vampires, #3)",eng
2663,23278537,"Nina George, Simon Pare",2013.0,The Little Paris Bookshop,eng
2664,13562049,Ian McEwan,2012.0,Sweet Tooth,eng
2665,17333880,Abbi Glines,2013.0,"Twisted Perfection (Rosemary Beach, #5; Perfection, #1)",eng
2666,19675,Tom Clancy,1996.0,"Executive Orders (Jack Ryan Universe, #9)",eng
2667,8592946,Ann Voskamp,2011.0,One Thousand Gifts: A Dare to Live Fully Right Where You Are,eng
2668,156427,Robert Bloch,1959.0,Psycho,eng
2669,45100,Robin Hobb,1998.0,"Ship of Magic (Liveship Traders, #1)",eng
2670,148337,"Alistair MacLean, Clint Willis",1967.0,Where Eagles Dare ,
2671,41977,Maeve Binchy,1990.0,Circle of Friends,eng
2672,23513349,Rupi Kaur,2014.0,Milk and Honey,eng
2673,5720,Tom Clancy,1998.0,"Rainbow Six (Jack Ryan Universe, #10)",eng
2674,16788,Neil Gaiman,2006.0,Fragile Things: Short Fictions and Wonders,eng
2675,8196732,Rosamund Lupton,2010.0,Sister,eng
2676,20518872,"Liu Cixin, Ken Liu",2007.0,"The Three-Body Problem (Remembrance of Earth’s Past, #1)",eng
2677,48002,Terry Pratchett,2001.0,"Thief of Time (Discworld, #26; Death, #5)",eng
2678,154798,"Mark Millar, Kilian Plunkett, Andrew Robinson, Walden Wong, Dave Johnson",2003.0,Superman: Red Son,eng
2679,227593,Julia Glass,2002.0,Three Junes,eng
2680,52309,"Benjamin Franklin, Lewis Leary",1791.0,The Autobiography of Benjamin Franklin,eng
2681,1858013,Timothy J. Keller,2007.0,The Reason for God: Belief in an Age of Skepticism,eng
2682,12891107,Mark  Lawrence,2012.0,"King of Thorns (The Broken Empire, #2)",eng
2683,12160906,Jeffrey Archer,2012.0,"The Sins of the Father (The Clifton Chronicles, #2)",eng
2684,187811,Meg Cabot,2000.0,"Shadowland (The Mediator, #1)",eng
2685,3047849,Sara Shepard,2009.0,"Killer (Pretty Little Liars, #6)",eng
2686,4898,"W. Chan Kim, Renée Mauborgne",2004.0,Blue Ocean Strategy: How To Create Uncontested Market Space And Make The Competition Irrelevant,
2687,6431790,James Patterson,2010.0,"Fang (Maximum Ride, #6)",eng
2688,8546358,Sarah Addison Allen,2011.0,The Peach Keeper,eng
2689,815234,"Audrey Wood, Don    Wood",1984.0,The Napping House,
2690,27239265,Matthew FitzSimmons,2015.0,"The Short Drop (Gibson Vaughn, #1)",eng
2691,33453,Christopher Moore,2007.0,"You Suck (A Love Story, #2)",eng
2692,18104607,Jamie McGuire,2014.0,"Beautiful Oblivion (The Maddox Brothers, #1)",eng
2693,77711,Vernor Vinge,1992.0,"A Fire Upon the Deep (Zones of Thought, #1)",eng
2694,6709,Eckhart Tolle,1999.0,"Practicing the Power of Now: Essential Teachings, Meditations, and Exercises from the Power of Now",
2695,19469,Caroline B. Cooney,1990.0,"The Face on the Milk Carton (Janie Johnson, #1)",eng
2696,413158,Robert Lopshire,1960.0,Put Me in the Zoo,eng
2697,6448470,Sophie Jordan,2010.0,"Firelight (Firelight, #1)",eng
2698,9809,"Italo Calvino, William Weaver",1972.0,Invisible Cities,eng
2699,11096647,Jessica Park,2011.0,"Flat-Out Love (Flat-Out Love, #1)",eng
2700,17905709,Richard Flanagan,2013.0,The Narrow Road to the Deep North,eng
2701,26582,"A.N. Roquelaure, Anne Rice",1983.0,"The Claiming of Sleeping Beauty (Sleeping Beauty, #1)",eng
2702,6114607,Jennifer Worth,2002.0,"The Midwife: A Memoir of Birth, Joy, and Hard Times",eng
2703,10882,Hunter S. Thompson,1966.0,Hell's Angels: A Strange and Terrible Saga,fre
2704,9758764,Jennifer Weiner,2010.0,Then Came You,eng
2705,395922,L.J. Smith,1991.0,"The Awakening (The Vampire Diaries, #1)",eng
2706,73070,Susan Elizabeth Phillips,1994.0,"It Had to Be You (Chicago Stars, #1)",eng
2707,13707738,Michael   Lewis,2011.0,Boomerang: Travels in the New Third World,eng
2708,7227174,Jennifer Weiner,2010.0,Fly Away Home,eng
2709,14662,"Stendhal, Roger Gard",1830.0,The Red and the Black,eng
2710,16183,Philippa Gregory,2004.0,"The Virgin's Lover (The Plantagenet and Tudor Novels, #13)",eng
2711,332775,Catherine Fisher,2007.0,"Incarceron (Incarceron, #1)",eng
2712,10800916,C.C. Hunter,2011.0,"Awake at Dawn (Shadow Falls, #2)",eng
2713,452157,Bev Vincent,2004.0,The Road to the Dark Tower: Exploring Stephen King's Magnum Opus,
2714,9462795,Josephine Angelini,2011.0,"Starcrossed (Starcrossed, #1)",eng
2715,7739934,Alyson Noel,2010.0,"Night Star (The Immortals, #5)",eng
2716,67238,N.H. Kleinbaum,1988.0,Dead Poets Society,eng
2717,23745132,Emily Bleeker,2015.0,Wreckage,eng
2718,63720,Terry Pratchett,1999.0,"The Fifth Elephant (Discworld, #24; City Watch, #5)",eng
2719,1524173,John Flanagan,2006.0,"The Sorcerer in the North (Ranger's Apprentice, #5)",eng
2720,639864,Paramahansa Yogananda,1946.0,Autobiography of a Yogi,eng
2721,9595650,Kevin Hearne,2011.0,"Hexed (The Iron Druid Chronicles, #2)",eng
2722,1325218,"Alvin Schwartz, Stephen Gammell",1981.0,"Scary Stories to Tell in the Dark (Scary Stories, #1)",eng
2723,26109394,Harlan Coben,2016.0,Fool Me Once,eng
2724,27323,John Hersey,1946.0,Hiroshima,eng
2725,6316171,Jennifer Brown,2009.0,Hate List,eng
2726,15283043,Kasie West,2013.0,The Distance Between Us,eng
2727,3873,Karen Armstrong,1975.0,"A History of God: The 4,000-Year Quest of Judaism, Christianity, and Islam",eng
2728,16131032,James S.A. Corey,2013.0,"Abaddon's Gate (The Expanse, #3)",eng
2729,5932,"Pablo Neruda, W.S. Merwin, Cristina García",1924.0,Twenty Love Poems and a Song of Despair,eng
2730,382549,Tom Clancy,1988.0,"The Cardinal of the Kremlin (Jack Ryan Universe, #5)",eng
2731,1062516,David Shannon,1998.0,"No, David!",eng
2732,18414,"Thomas More, Paul Turner",1516.0,Utopia,eng
2733,1099301,"Pseudonymous Bosch, Gilbert Ford",2007.0,"The Name of This Book Is Secret (Secret, #1)",eng
2734,18053060,Danielle  Paige,2014.0,"Dorothy Must Die (Dorothy Must Die, #1)",eng
2735,16429,Dean Koontz,2006.0,The Husband,eng
2736,7048800,Aimee Bender,2010.0,The Particular Sadness of Lemon Cake,eng
2737,6588,James Patterson,2003.0,"The Big Bad Wolf  (Alex Cross, #9)",eng
2738,533465,"Dai Sijie, Ina Rilke",2000.0,Balzac and the Little Chinese Seamstress,eng
2739,18813642,Roxane Gay,2014.0,Bad Feminist,eng
2740,226709,V.C. Andrews,1980.0,"Petals on the Wind (Dollanganger, #2)",eng
2741,6690,"Roald Dahl, Quentin Blake",1975.0,Danny the Champion of the World,
2742,9160695,Amy Chua,2011.0,Battle Hymn of the Tiger Mother,eng
2743,19351043,Noelle Stevenson,2015.0,Nimona,eng
2744,1192,Giada De Laurentiis,2005.0,Everyday Italian: 125 Simple and Delicious Recipes,
2745,6537,Patricia Cornwell,1995.0,"From Potter's Field (Kay Scarpetta, #6)",eng
2746,84736,James Patterson,2005.0,"Mary, Mary (Alex Cross, #11)",eng
2747,15055,Jeanette Winterson,1985.0,Oranges Are Not the Only Fruit,eng
2748,16139641,R.K. Lilley,2013.0,"Grounded (Up in the Air, #3)",eng
2749,19427193,Ravinder Singh,2007.0,I Too Had a Love Story,eng
2750,25051,"Betty MacDonald, Alexandra Boiger",1947.0,"Mrs. Piggle-Wiggle (Mrs. Piggle Wiggle, #1)",eng
2751,58962,Michael Connelly,1997.0,"Trunk Music (Harry Bosch, #5; Harry Bosch Universe, #6)",eng
