book_id,goodreads_book_id,authors,original_publication_year,title,language_code
7411,77787,Timothy Zahn,1997.0,"Specter of the Past (Star Wars: The Hand of Thrawn, #1)",eng
7412,25507925,Tyler Oakley,2015.0,Binge,
7413,22471294,Alessandra Torre,2014.0,Black Lies,eng
7414,351648,Laura Lippman,2007.0,What the Dead Know,eng
7415,17798233,"Jay Crownover, Charlotte Connan de vries",2014.0,"Rome (Marked Men, #3)",eng
7416,76527,"Laurence Sterne, Melvyn New",1767.0,"The Life and Opinions of Tristram Shandy, Gentleman",eng
7417,765148,"Giles Andreae, Guy Parker-Rees",,Giraffes Can't Dance,eng
7418,98048,Susan Vreeland,2001.0,The Passion of Artemisia,eng
7419,270435,Louise L. Hay,1976.0,Heal Your Body: The Mental Causes for Physical Illness and the Metaphysical Way to Overcome Them,eng
7420,284698,"Mia Ikumi, Reiko Yoshida",2003.0,"Tokyo Mew Mew, Vol. 1 (Tokyo Mew Mew, #1)",eng
7421,11595276,Emily M. Danforth,2012.0,The Miseducation of Cameron Post,eng
7422,1967070,"Neil Gaiman, P. Craig Russell",2008.0,Coraline (Illustrated/Graphic Novel Edition),eng
7423,2173611,Diana Wynne Jones,2008.0,"House of Many Ways (Howl's Moving Castle, #3)",eng
7424,23602561,Don Winslow,2015.0,The Cartel,eng
7425,25937671,Sue Klebold,2016.0,A Mother's Reckoning: Living in the Aftermath of Tragedy,eng
7426,13062,Carl Hiaasen,1989.0,"Skin Tight (Mick Stranahan, #1)",eng
7427,3750,Ian Fleming,1955.0,"Moonraker (James Bond, #3)",eng
7428,364550,"John Locke, Peter Laslett, Raymond Geuss",1689.0,Two Treatises of Government,eng
7429,16900,Henry David Thoreau,1995.0,Civil Disobedience and Other Essays,eng
7430,17533,Louisa May Alcott,1876.0,"Rose in Bloom (Eight Cousins, #2)",eng
7431,18718848,David  Arnold,2015.0,Mosquitoland,eng
7432,25228579,Barbara Claypole White,2015.0,The Perfect Son,eng
7433,82436,Melina Marchetta,1992.0,Looking for Alibrandi,eng
7434,17257993,Kristen Ashley,2013.0,"Raid (Unfinished Hero, #3)",eng
7435,15813668,Darynda Jones,2013.0,"Fifth Grave Past the Light (Charley Davidson, #5)",eng
7436,416580,Wilbur Smith,1995.0,"The Seventh Scroll (Ancient Egypt, #2)",eng
7437,12813860,Kody Keplinger,2012.0,A Midsummer's Nightmare,eng
7438,17571466,Nick Cutter,2014.0,The Troop,eng
7439,820480,C.J. Sansom,2008.0,"Revelation (Matthew Shardlake, #4)",eng
7440,11339,"Pablo Neruda, Stephen Tapscott",1959.0,100 Love Sonnets,eng
7441,18316089,Amy Bloom,2014.0,Lucky Us,
7442,110393,Julia Quinn,2005.0,"It's in His Kiss (Bridgertons, #7)",eng
7443,31538614,"J.K. Rowling, MinaLima",2016.0,"Short Stories from Hogwarts of Power, Politics and Pesky Poltergeists (Pottermore Presents, #2)",eng
7444,9454,"Georg Wilhelm Friedrich Hegel, A.V. Miller, John Niemeyer Findlay",1807.0,Phenomenology of Spirit,eng
7445,17257990,Kristen Ashley,2013.0,"Fire Inside (Chaos, #2)",eng
7446,479561,Peter F. Hamilton,1997.0,"The Neutronium Alchemist (Night's Dawn, #2)",eng
7447,9995135,Gena Showalter,2012.0,The Darkest Seduction (Lords of the Underworld #9),eng
7448,30226723,Victoria Aveyard,2017.0,"King's Cage (Red Queen, #3)",eng
7449,6345193,Paul Auster,2009.0,Invisible,eng
7450,5557442,يوسف زيدان,2006.0,ظل الأفعى,ara
7451,9266810,Sarah Mlynowski,2011.0,Ten Things We Did (and Probably Shouldn't Have),eng
7452,13042154,Moira Young,2012.0,"Rebel Heart (Dust Lands, #2)",eng
7453,4507,Julie Gregory,2003.0,Sickened: The Memoir of a Munchausen by Proxy Childhood,
7454,96082,Anita Shreve,2001.0,The Last Time They Met,
7455,25817493,Paulette Jiles,2016.0,News of the World,eng
7456,40710,Brad Thor,2005.0,"Blowback (Scot Harvath, #4)",eng
7457,9864913,Devdutt Pattanaik,2010.0,Jaya: An Illustrated Retelling of the Mahabharata,eng
7458,51114,Gail Tsukiyama,1991.0,Women of the Silk,eng
7459,54492,Anthony Hope,1894.0,The Prisoner of Zenda,eng
7460,8349348,Amanda Hocking,2010.0,"Flutter (My Blood Approves, #3)",eng
7461,18089551,Tammy Falkner,2013.0,"Tall, Tatted and Tempting (The Reed Brothers, #1)",eng
7462,456,Paul Auster,1992.0,Leviathan,eng
7463,15157,David Baldacci,1999.0,Saving Faith,eng
7464,171471,R.A. Salvatore,1999.0,"The Spine of the World (Forgotten Realms: Paths of Darkness, #2; Legend of Drizzt, #12)",eng
7465,308540,R.L. Stine,1993.0,"The Haunted Mask (Goosebumps, #11)",eng
7466,136641,Douglas Preston,2005.0,Tyrannosaur Canyon (Wyman Ford #1),eng
7467,28016509,J.P. Delaney,2017.0,The Girl Before,eng
7468,15673,Louis Sachar,1995.0,Wayside School Gets A Little Stranger (Wayside School #3),eng
7469,11279,Dan Simmons,1991.0,Summer of Night,eng
7470,4961959,"Jim Butcher, Mark Powers, Ardian Syaf",2009.0,"The Dresden Files:  Storm Front, Volume 1-  The Gathering Storm",eng
7471,13064,Carl Hiaasen,1986.0,Tourist Season,eng
7472,16076787,أحمد خالد توفيق,2012.0,السنجة,ara
7473,366346,Debbie Macomber,2002.0,"204 Rosewood Lane (Cedar Cove, #2)",eng
7474,16071767,Karin Slaughter,2013.0,"Unseen (Will Trent, #7)",eng
7475,6681333,Heather Brewer,2010.0,"Eleventh Grade Burns (The Chronicles of Vladimir Tod, #4)",
7476,175324,Robert A. Heinlein,1956.0,Double Star,eng
7477,390305,Alex Kava,2000.0,"A Perfect Evil (Maggie O'Dell, #1)",eng
7478,15737147,Anne Lamott,2012.0,Help Thanks Wow: The Three Essential Prayers,eng
7479,7981,"Brian Jacques, Allan Curless",1997.0,"The Long Patrol (Redwall, #10)",
7480,11107244,Steven Pinker,2010.0,The Better Angels of Our Nature: Why Violence Has Declined,eng
7481,821003,"A.A. Milne, Ernest H. Shepard",1924.0,"When We Were Very Young (Winnie-the-Pooh, #3)",eng
7482,22367526,M.O. Walsh,2015.0,My Sunshine Away,eng
7483,370057,Dee Henderson,2001.0,The Truth Seeker (O'Malley #3),
7484,1244286,Dee Lestari,2006.0,Filosofi Kopi: Kumpulan Cerita dan Prosa Satu Dekade,ind
7485,364826,"Mika Waltari, ذبیح‌الله منصوری",1945.0,سینوهه,per
7486,7907782,Nicole Krauss,2010.0,Great House,eng
7487,28374062,Karin Slaughter,2016.0,"The Kept Woman (Will Trent, #8)",eng
7488,11808919,Marie Force,2011.0,"Maid for Love (Gansett Island Series, #1)",eng
7489,95619,Francine Rivers,2003.0,And the Shofar Blew,eng
7490,31357,Orson Scott Card,1989.0,"Prentice Alvin (Tales of Alvin Maker, #3)",eng
7491,97875,Alexander McCall Smith,2005.0,"44 Scotland Street (44 Scotland Street, #1)",eng
7492,268275,Sandra Brown,2005.0,Chill Factor,eng
7493,2108198,"Neil Gaiman, Mark Buckingham",2008.0,Odd and the Frost Giants,eng
7494,17726978,Mark  Edwards,2013.0,The Magpies,eng
7495,669780,"Tayeb Salih, Denys Johnson-Davies",1966.0,Season of Migration to the North,eng
7496,24100,Doris Lessing,1962.0,The Golden Notebook,eng
7497,396266,Jennifer Donnelly,2008.0,"The Winter Rose (The Tea Rose, #2)",
7498,29923,Jeff Shaara,1991.0,"The Last Full Measure (The Civil War Trilogy, #3)",eng
7499,120461,Éric-Emmanuel Schmitt,1996.0,Oscar et la dame rose,
7500,46676,Harold S. Kushner,1981.0,When Bad Things Happen to Good People,
7501,17768,Patrick O'Brian,1972.0,"Post Captain (Aubrey/Maturin, #2)",eng
7502,2208744,Jessica Day George,2008.0,"Dragon Flight (Dragon Slippers, #2)",eng
7503,730501,Susan Coolidge,1872.0,"What Katy Did (Carr Family, #1)",eng
7504,766917,Robert McCloskey,1942.0,Homer Price (A Puffin Book),eng
7505,153782,Tamora Pierce,2003.0,"Shatterglass (The Circle Opens, #4)",eng
7506,18878,David Eddings,1982.0,"The Belgariad, Vol. 1: Pawn of Prophecy / Queen of Sorcery / Magician's Gambit (The Belgariad, #1-3)",eng
7507,359194,Philip G. Zimbardo,2007.0,The Lucifer Effect: Understanding How Good People Turn Evil,eng
7508,6606456,Nancy Pickard,2010.0,The Scent of Rain and Lightning,eng
7509,361081,"Clive Cussler, Michael Pritchard",1983.0,"Pacific Vortex! (Dirk Pitt, #1)",eng
7510,17835766,Abbi Glines,2014.0,"One More Chance (Rosemary Beach, #8; Chance, #2)",eng
7511,23197269,Kim Stanley Robinson,2015.0,Aurora,eng
7512,238137,J.D. Robb,2002.0,"Purity in Death (In Death, #15)",eng
7513,116343,Mary  Stewart,1973.0,"The Hollow Hills (Arthurian Saga, #2)",eng
7514,303454,Margaret Peterson Haddix,2004.0,"Among the Brave (Shadow Children, #5)",eng
7515,43081,"Rusty Young, Thomas McFadden",2003.0,"Marching Powder: A True Story of Friendship, Cocaine, and South America's Strangest Jail",eng
7516,1025039,Fuyumi Soryo,1996.0,"Mars, Volume 01",eng
7517,5553,Richard Feynman,1962.0,Six Easy Pieces: Essentials of Physics By Its Most Brilliant Teacher,eng
7518,688663,Alice Waters,2007.0,"The Art of Simple Food: Notes, Lessons, and Recipes from a Delicious Revolution",
7519,96980,Piers Anthony,1981.0,"Centaur Aisle (Xanth, #4)",
7520,332348,Michelle Richmond,2006.0,The Year of Fog,
7521,194479,"Marv Wolfman, George Pérez",1985.0,Crisis on Infinite Earths,eng
7522,24807,John Hodgman,2005.0,The Areas of My Expertise: An Almanac of Complete World Knowledge Compiled with Instructive Annotation and Arranged in Useful Order,eng
7523,31538647,J.K. Rowling,2016.0,"Hogwarts: An Incomplete and Unreliable Guide (Pottermore Presents, #3)",eng
7524,19314,"Astrid Lindgren, Patricia Crampton, Trina Schart Hyman",1981.0,"Ronia, the Robber's Daughter",eng
7525,7189177,Kathy Reichs,2010.0,"Spider Bones (Temperance Brennan, #13)",eng
7526,235127,Andrew Clements,2007.0,No Talking,eng
7527,23602504,"Jo Nesbø, Neil Smith",2014.0,"Blood on Snow (Blood on Snow, #1)",eng
7528,13282015,Elisabeth Naughton,2011.0,"Wait for Me (Against All Odds, #1)",eng
7529,12031532,Tan Twan Eng,2011.0,The Garden of Evening Mists,eng
7530,16066586,Natasha Preston,2014.0,"The Cellar (The Cellar, #1)",eng
7531,696177,Arina Tanemura,2005.0,"The Gentlemen's Alliance †, Vol. 1",eng
7532,18775203,Alice Clayton,2014.0,"Rusty Nailed (Cocktail, #2)",eng
7533,94813,Christine Feehan,2002.0,"Dark Guardian (Dark, #9)",eng
7534,8492,Frank E. Peretti,1992.0,Prophet,eng
7535,18602341,Danielle  Paige,2015.0,"The Wicked Will Rise (Dorothy Must Die, #2)",eng
7536,313263,Christine Feehan,2001.0,"Dark Fire (Dark, #6)",eng
7537,20613761,Claudia Rankine,2014.0,Citizen: An American Lyric,eng
7538,16387,P.G. Wodehouse,1925.0,"Carry on, Jeeves (Jeeves, #3)",eng
7539,1809175,"Sarah Prineas, Antonio Javier Caparo",2008.0,"The Magic Thief (Magic Thief, #1)",eng
7540,29393,Michael Azerrad,2001.0,Our Band Could Be Your Life: Scenes from the American Indie Underground 1981-1991,
7541,56353,Rosalind Miles,1992.0,"I, Elizabeth",eng
7542,22009741,Marian Keyes,2014.0,The Woman Who Stole My Life,eng
7543,80834,Guy Delisle,2003.0,Pyongyang: A Journey in North Korea,eng
7544,5055,Ken Follett,1991.0,Night Over Water,eng
7545,18775284,Courtney Maum,2014.0,I Am Having So Much Fun Here Without You,eng
7546,22192,Cecily von Ziegesar,2003.0,"All I Want is Everything (Gossip Girl, #3)",eng
7547,407999,Michael E. Porter,1980.0,Competitive Strategy: Techniques for Analyzing Industries and Competitors,
7548,255458,Wayne A. Grudem,1994.0,Systematic Theology: An Introduction to Biblical Doctrine,
7549,380976,Sue Grafton,2000.0,"P is for Peril (Kinsey Millhone, #16)",
7550,25855506,Sarah Andersen,2016.0,"Adulthood Is a Myth (Sarah's Scribbles, #1)",eng
7551,301538,R. Scott Bakker,2003.0,"The Darkness That Comes Before (The Prince of Nothing, #1)",eng
7552,7841677,Kristin Kimball,2010.0,"The Dirty Life: On Farming, Food, and Love",eng
7553,9917998,Jonathan Maberry,2011.0,"Dust & Decay (Rot & Ruin, #2)",eng
7554,13574417,Melissa Landers,2014.0,"Alienated (Alienated, #1)",eng
7555,18806240,Laura Ruby,2015.0,Bone Gap,eng
7556,52471,Adriana Trigiani,2001.0,"Big Cherry Holler (Big Stone Gap, #2)",eng
7557,13069213,Marcus Samuelsson,2012.0,"Yes, Chef",eng
7558,90475,Meg Cabot,2004.0,Teen Idol,eng
7559,5587960,Chimamanda Ngozi Adichie,2009.0,The Thing Around Your Neck,eng
7560,27883214,Stephanie Garber,2017.0,Caraval,eng
7561,2179832,James Frey,2008.0,Bright Shiny Morning,eng
7562,2267195,Kate Chopin,1894.0,The Story of an Hour,eng
7563,85391,John Updike,1981.0,Rabbit Is Rich (Rabbit Angstrom #3),eng
7564,12752313,Anna Quindlen,2012.0,"Lots of Candles, Plenty of Cake",eng
7565,7531478,Cheryl Rainfield,2010.0,Scars,eng
7566,5941079,Mary Kay Andrews,2009.0,The Fixer Upper,eng
7567,6688121,Ahmad Fuadi,2009.0,"Negeri 5 Menara (Negeri 5 Menara, #1)",ind
7568,129510,Naomi Novik,2007.0,"Empire of Ivory (Temeraire, #4)",
7569,541920,Rick Atkinson,2002.0,"An Army at Dawn: The War in North Africa, 1942-1943 (World War II Liberation Trilogy, #1)",eng
7570,170618,Mary Higgins Clark,2002.0,Daddy's Little Girl,
7571,30343,Sandra Brown,2006.0,Ricochet,eng
7572,199530,Fannie Flagg,2006.0,Can't Wait to Get to Heaven,eng
7573,8706185,Jo Walton,2011.0,Among Others,eng
7574,238127,J.D. Robb,2001.0,"Seduction in Death (In Death, #13)",eng
7575,56616,James M. Cain,1936.0,Double Indemnity,eng
7576,490403,Sherrilyn Kenyon,2007.0,"Upon the Midnight Clear (Dark-Hunter #12, Dream-Hunter #2)",eng
7577,1908456,Garr Reynolds,2007.0,Presentation Zen: Simple Ideas on Presentation Design and Delivery,
7578,239107,R.A. Salvatore,2001.0,"Sea of Swords (Forgotten Realms: Paths of Darkness, #4; Legend of Drizzt, #13)",eng
7579,29744,Philip Roth,1959.0,"Goodbye, Columbus and Five Short Stories",
7580,9366879,"Tom Sniegoski, Jeff Smith, Thomas E. Sniegoski, Steve Hamaker",2009.0,"Bone: Quest for the Spark, Vol. 1",eng
7581,9512985,Josh Kaufman,2010.0,The Personal MBA: Master the Art of Business,
7582,16248139,Dorothea Benton Frank,2013.0,The Last Original Wife,eng
7583,7200351,Sherrilyn Kenyon,2010.0,"No Mercy (Dark-Hunter #18, Were-Hunter, #5)",eng
7584,23363928,Scott  Hawkins,2015.0,The Library at Mount Char,eng
7585,551536,Chris d'Lacey,2005.0,"Fire Star (The Last Dragon Chronicles, #3)",eng
7586,12659,James A. Michener,1985.0,Texas,
7587,95707,Joel Osteen,2004.0,Your Best Life Now: 7 Steps to Living at Your Full Potential,
7588,6871737,Jennifer L. Holm,2010.0,Turtle in Paradise,eng
7589,68483,Lois McMaster Bujold,1990.0,"The Vor Game (Vorkosigan Saga, #6)",eng
7590,8765461,"Mary Beth Chapman, Steven Curtis Chapman",2010.0,Choosing to SEE,
7591,20706269,Lauren Beukes,2014.0,Broken Monsters,eng
7592,11623,"Sylvia Plath, Karen V. Kukil",1982.0,The Unabridged Journals of Sylvia Plath,eng
7593,5986375,David Foster Wallace,2009.0,"This Is Water: Some Thoughts, Delivered on a Significant Occasion, about Living a Compassionate Life",eng
7594,5552,Richard Feynman,1985.0,QED: The Strange Theory of Light and Matter,
7595,8835897,"Lili St. Crow, Lilith Saintcrow",2011.0,"Defiance (Strange Angels, #4)",
7596,11919,Kelley Armstrong,2005.0,"Haunted (Women of the Otherworld, #5)",eng
7597,269386,Jill Conner Browne,1999.0,The Sweet Potato Queens' Book of Love,eng
7598,2964700,Tamora Pierce,2011.0,"Mastiff (Beka Cooper, #3)",eng
7599,179264,Debra Dean,2006.0,The Madonnas of Leningrad,
7600,6098691,Laurell K. Hamilton,2009.0,"Divine Misdemeanors (Merry Gentry, #8)",eng
7601,2983654,Chelsea Cain,2008.0,"Sweetheart (Archie Sheridan & Gretchen Lowell, #2)",eng
7602,7011225,José Saramago,2009.0,Caim,por
7603,22321,William Gibson,1999.0,"All Tomorrow's Parties (Bridge, #3)",eng
7604,7562764,Hannu Rajaniemi,2010.0,"The Quantum Thief (Jean le Flambeur, #1)",eng
7605,9925913,John Sandford,2011.0,"Shock Wave (Virgil Flowers, #5)",eng
7606,12075,Ludwig Wittgenstein,1921.0,Tractatus Logico-Philosophicus,eng
7607,215492,Agatha Christie,1933.0,"Lord Edgware Dies (Hercule Poirot, #9)",eng
7608,107021,"Jeph Loeb, Jim Lee, Scott Williams",2003.0,"Batman: Hush, Vol. 2",eng
7609,5600151,Spencer Quinn,2008.0,Dog on It (A Chet and Bernie Mystery #1),eng
7610,13167062,Mary Kay Andrews,2012.0,Spring Fever,eng
7611,28351,Dr. Seuss,1937.0,And to Think That I Saw it on Mulberry Street,eng
7612,17334495,Doris Kearns Goodwin,2013.0,"The Bully Pulpit: Theodore Roosevelt, William Howard Taft, and the Golden Age of Journalism",eng
7613,15801381,Brandon Mull,2013.0,"Chasing the Prophecy (Beyonders, #3)",eng
7614,77736,David Weber,1994.0,"The Short Victorious War (Honor Harrington, #3)",
7615,73965,Caroline Knapp,1996.0,Drinking: A Love Story,
7616,1219103,Jules Verne,1863.0,"Five Weeks in a Balloon (Extraordinary Voyages, #1)",
7617,10324808,"P.C. Cast, Kristin Cast",2011.0,"Dragon's Oath (House of Night Novellas, #1)",eng
7618,7823038,Kalayna Price,2010.0,"Grave Witch (Alex Craft, #1)",eng
7619,16300,Agatha Christie,1976.0,"Sleeping Murder (Miss Marple, #13)",eng
7620,212525,"Edith Wharton, Mary Gordon",1911.0,Ethan Frome and Other Short Fiction,eng
7621,13419891,Sarah J. Maas,2012.0,"The Assassin and the Desert (Throne of Glass, #0.3)",eng
7622,132626,"Friedrich Nietzsche, Walter Kaufmann, R.J. Hollingdale",1887.0,On the Genealogy of Morals/Ecce Homo,eng
7623,121410,Steven Callahan,1986.0,Adrift: Seventy-Six Days Lost at Sea,eng
7624,129620,Judith McNaught,1987.0,"Once and Always (Sequels, #1)",eng
7625,13148921,James Rollins,2012.0,"Bloodline (Sigma Force, #8)",eng
7626,95658,Lisi Harrison,2004.0,"Best Friends for Never (The Clique, #2)",
7627,11734251,Bernard Cornwell,2011.0,"Death of Kings (The Saxon Stories, #6)",eng
7628,9151181,"Howard Schultz, Joanne Gordon",2007.0,Onward: How Starbucks Fought for Its Life without Losing Its Soul,eng
7629,978098,Laurence Rees,2005.0,Auschwitz,eng
7630,9013,Slavomir Rawicz,1956.0,The Long Walk: The True Story of a Trek to Freedom,eng
7631,682153,Nora Roberts,2002.0,Three Fates,eng
7632,20983362,Alexandra Bracken,2016.0,"Passenger (Passenger, #1)",eng
7633,102857,"J.D. Robb, Susan Ericksen",2006.0,"Born in Death (In Death, #23)",eng
7634,18666006,Chris Bohjalian,2014.0,"Close Your Eyes, Hold Hands",eng
7635,834378,Agatha Christie,1953.0,"A Pocket Full of Rye (Miss Marple, #7)",eng
7636,7011879,"Durjoy Datta, Maanvi Ahuja",2008.0,Of Course I Love You...! Till I Find Someone Better...,eng
7637,184850,Robyn Carr,2007.0,"Virgin River (Virgin River, #1)",
7638,12009,Iain M. Banks,2004.0,The Algebraist,eng
7639,192510,"José Mauro de Vasconcelos, قاسم صنعوی",1968.0,درخت زیبای من,per
7640,22642472,Margaret Atwood,2014.0,Stone Mattress: Nine Tales,eng
7641,262545,Ivan Doig,2006.0,The Whistling Season,
7642,16000044,"Morgan Rhodes, Michelle Rowen",2013.0,"Rebel Spring (Falling Kingdoms, #2)",eng
7643,18170134,"James Patterson, Marshall Karp",2014.0,"NYPD Red 2 (NYPD Red, #2)",eng
7644,12661,James A. Michener,1978.0,Chesapeake,eng
7645,2430,Steve Martini,1997.0,The List,eng
7646,197436,Gloria Levine,,Ralph S. Mouse by Beverly Cleary: Teacher Guide (Novel Units),
7647,37100,Walter Mosley,1990.0,"Devil in a Blue Dress (Easy Rawlins, #1)",eng
7648,265650,"Michael Rosen, Jane Ray",2003.0,Shakespeare's Romeo and Juliet,
7649,298663,Jim Thompson,1952.0,The Killer Inside Me,
7650,588747,Mary Elizabeth Braddon,1862.0,Lady Audley's Secret,eng
7651,2528,"José Saramago, Margaret Jull Costa",1997.0,All the Names,eng
7652,60057,Adriana Trigiani,2003.0,"Lucia, Lucia",eng
7653,7514925,Jodi Lynn Anderson,2012.0,Tiger Lily,eng
7654,11430,"Karen Kingsbury, Gary Smalley",2003.0,"Return (Redemption, #3)",eng
7655,114982,Philip Pullman,1985.0,"The Ruby in the Smoke (Sally Lockhart, #1)",eng
7656,319300,Amanda Foreman,1998.0,Georgiana: Duchess of Devonshire,eng
7657,11983940,A.C. Gaughen,2012.0,"Scarlet (Scarlet, #1)",eng
7658,12551077,Miranda Kenneally,2012.0,Stealing Parker,eng
7659,26114516,Mary Kay Andrews,2016.0,The Weekenders,
7660,21330,"Bill Willingham, Mark Buckingham, Steve Leialoha, Tony Akins, Jimmy Palmiotti",2005.0,"Fables, Vol. 5: The Mean Seasons",eng
7661,82888,Machado de Assis,1899.0,Dom Casmurro,por
7662,57913,"Robert Shea, Robert Anton Wilson",1975.0,The Illuminatus! Trilogy,eng
7663,6420846,Alexander Gordon Smith,2009.0,"Lockdown (Escape from Furnace, #1)",eng
7664,16696,"Michael Chabon, Jay Ryan",2004.0,The Final Solution,eng
7665,7010683,Nancy Thayer,2010.0,Beachcombers,eng
7666,7870457,"John Layman, Rob Guillory",2010.0,"Chew, Vol. 2: International Flavor",eng
7667,452244,Poppy Z. Brite,1992.0,Lost Souls,eng
7668,86658,Joseph Conrad,1907.0,The Secret Agent,
7669,514210,Alan W. Watts,1957.0,The Way of Zen,eng
7670,13642710,Ramez Naam,2012.0,"Nexus (Nexus, #1)",eng
7671,896622,Kathleen E. Woodiwiss,1974.0,The Wolf and the Dove,
7672,18080923,Veronica Roth,2014.0,"The Traitor (Divergent, #0.4)",eng
7673,21412360,Colm Tóibín,2014.0,Nora Webster,eng
7674,11532160,Jamie McGuire,2011.0,"Requiem (Providence, #2)",eng
7675,7840156,Steve Berry,2010.0,"The Emperor's Tomb (Cotton Malone, #6)",eng
7676,18079661,Lisa Gardner,2014.0,"Fear Nothing (Detective D.D. Warren, #7)",eng
7677,184644,"Dorie Greenspan, Alan    Richardson",1980.0,Baking: From My Home to Yours,eng
7678,7290826,Jane Green,2010.0,Promises to Keep,eng
7679,10813480,Kristen Ashley,2011.0,"For You (The 'Burg, #1)",eng
7680,439363,"Aya Nakahara, Pookie Rolf",2001.0,"Love★Com, Vol. 1",eng
7681,148584,Agatha Christie,1972.0,"Elephants Can Remember (Hercule Poirot, #37)",eng
7682,17948485,Belle Aurora,2013.0,"Friend-Zoned (Friend-Zoned, #1)",eng
7683,98,"Heidi Murkoff, Sharon Mazel, Heidi Murkoff, Arlene Eisenberg, Sandee Hathaway, Mark D. Widome",1989.0,What to Expect the First Year (What to Expect),eng
7684,59836,Danielle Steel,1986.0,The Gift,eng
7685,11699349,Kristin Levine,2012.0,The Lions of Little Rock,eng
7686,169487,Phillip C. McGraw,2000.0,Self Matters: Creating Your Life from the Inside Out,eng
7687,8951449,Amanda Hocking,2010.0,"Hollowland (The Hollows, #1)",eng
7688,7942008,Hidekaz Himaruya,2008.0,"Hetalia: Axis Powers, Vol. 1 (Hetalia: Axis Powers, #1)",eng
7689,1298171,"Andrew Stanton, Walt Disney Company",1996.0,Finding Nemo,
7690,14480,"Herman Parish, Lynn Sweat",2002.0,Calling Doctor Amelia Bedelia,
7691,11324166,Gail Carriger,2012.0,"Timeless (Parasol Protectorate, #5)",eng
7692,112874,Jan Karon,1995.0,"These High, Green Hills (Mitford Years, #3)",
7693,23158207,"Eric Schmidt, Jonathan Rosenberg",2014.0,How Google Works,eng
7694,20559676,J.A. Redmerski,2013.0,"Killing Sarai (In the Company of Killers, #1)",eng
7695,10893138,Cecelia Ahern,2011.0,The Time of My Life,eng
7696,821000,"A.A. Milne, Ernest H. Shepard",1927.0,"Now We Are Six (Winnie-the-Pooh, #4)",eng
7697,3665811,L.J. Smith,2009.0,"The Captive Part II / The Power (The Secret Circle, #2-3)",eng
7698,16045078,Mary Kay Andrews,2013.0,Ladies' Night,eng
7699,14759321,Jane Green,2013.0,Family Pictures ,eng
7700,7384801,Lara Adrian,2010.0,"Taken by Midnight (Midnight Breed, #8)",eng
7701,1249630,"José Maria de Eça de Queirós, Ester de Lemos",1888.0,Os Maias,por
7702,23252517,Amy Harmon,2014.0,"The Law of Moses (The Law of Moses, #1)",eng
7703,29975458,Amy Gentry,2016.0,Good as Gone,eng
7704,114188,Nora Roberts,1996.0,Holding the Dream (Dream Trilogy #2),eng
7705,17191012,Tijan,2013.0,"Fallen Crest Family (Fallen Crest High, #2)",eng
7706,99297,Amanda Grange,2005.0,"Mr. Darcy's Diary (Jane Austen Heroes, #1)",eng
7707,297186,Robert Crais,1999.0,"L.A. Requiem (Elvis Cole, #8)",fre
7708,10960383,Joshilyn Jackson,2010.0,A Grown-Up Kind of Pretty,eng
7709,15733346,Miranda Hart,2012.0,Is It Just Me?,eng
7710,89884,Kent Haruf,2004.0,"Eventide (Plainsong, #2)",eng
7711,5199185,"Tim Hamilton, Ray Bradbury",2009.0,Fahrenheit 451: The Authorized Adaptation,eng
7712,2122216,Maki Minami,2003.0,"Special A, Vol. 1 (Special A, #1)",ind
7713,6255949,"Hiroshi Sakurazaka, 桜坂洋, Alexander O. Smith, Joseph Reeder",2004.0,All You Need Is Kill,eng
7714,24408,Elizabeth George Speare,1961.0,The Bronze Bow,eng
7715,23426,Alain de Botton,1993.0,On Love,eng
7716,27397,Jonathan Harr,1995.0,A Civil Action,eng
7717,621739,Wanda Gág,1928.0,Millions of Cats,
7718,313256,Christine Feehan,2000.0,"Dark Challenge (Dark, #5)",
7719,15791403,"James Patterson, David Ellis",2013.0,Mistress,
7720,208146,Allen Say,1993.0,Grandfather's Journey,eng
7721,38030,Mary Kay Andrews,2002.0,"Savannah Blues (Weezie and Bebe Mysteries, #1)",eng
7722,294043,James Rollins,2000.0,Excavation,eng
7723,159418,"René Descartes, Donald A. Cress",1637.0,Discourse on Method,eng
7724,144789,Matthew Reilly,2003.0,"Scarecrow (Shane Schofield, #3)",eng
7725,9064899,Kiersten White,2012.0,"Endlessly (Paranormalcy, #3)",eng
7726,27868677,Ella Carey,2016.0,The House by the Lake,eng
7727,73184,Thich Nhat Hanh,1995.0,"Living Buddha, Living Christ",eng
7728,1170158,Ursula K. Le Guin,1975.0,The Earthsea Trilogy,eng
7729,17325147,Jessica Park,2013.0,"Left Drowning (Left Drowning, #1)",eng
7730,7268995,"Philip C. Stead, Erin E. Stead",2010.0,A Sick Day for Amos McGee,eng
7731,18651980,Smith Henderson,2014.0,Fourth of July Creek,eng
7732,276877,Lisa Jackson,2007.0,"Absolute Fear (New Orleans, #4)",eng
7733,43992,Greg Iles,2006.0,True Evil,eng
7734,59091,"Erskine Caldwell, Lewis Nordan",1932.0,Tobacco Road (Brown Thrasher Books),eng
7735,1747896,Kate Summerscale,2008.0,The Suspicions of Mr. Whicher: A Shocking Murder and the Undoing of a Great Victorian Detective,eng
7736,425377,Loretta Chase,1995.0,"Lord of Scoundrels (Scoundrels, #3)",eng
7737,60177,L. Frank Baum,1907.0,"Ozma of Oz (Oz, #3)",eng
7738,2371,David McCullough,1968.0,The Johnstown Flood,eng
7739,3268926,Glenn Beck,2008.0,The Christmas Sweater,eng
7740,16074748,Rachel Renée Russell,2010.0,"Tales from a Not-So-Happy Heartbreaker (Dork Diaries, #6)",eng
7741,294045,James Rollins,2001.0,Deep Fathom,eng
7742,3216451,Nelson DeMille,2008.0,The Gate House,eng
7743,19501672,"J. Lynn, Jennifer L. Armentrout",2014.0,"Stay with Me (Wait for You, #3)",eng
7744,15743075,Sylvia Day,2011.0,Seven Years to Sin,eng
7745,13580928,Ally Carter,2013.0,"Perfect Scoundrels (Heist Society, #3)",eng
7746,6562380,"Larry Bird, Earvin Johnson, Jackie MacMullan",2009.0,When the Game Was Ours,eng
7747,66676,R.A. Salvatore,2004.0,"The Two Swords (Forgotten Realms: Hunter's Blades, #3; Legend of Drizzt, #16)",eng
7748,31304,Agatha Christie,1971.0,"Nemesis (Miss Marple, #12)",eng
7749,3379,Douglas Coupland,2001.0,All Families are Psychotic,
7750,867387,Tony Hillerman,1970.0,"The Blessing Way (Leaphorn & Chee, #1)",eng
7751,12029468,Jane Green,2012.0,Another Piece of My Heart,eng
7752,1457790,Camilla Läckberg,2005.0,"Stenhuggaren (Patrik Hedström, #3)",swe
7753,1908511,Mo Willems,2008.0,The Pigeon Wants a Puppy!,eng
7754,22551809,David  Brooks,2015.0,The Road to Character,eng
